commentId,parentId,videoId,textDisplay,publishedAt,authorDisplayName,authorProfileImageUrl
UgwYXcAl28coZzLv3HR4AaABAg,0,vN30emwcNS4,very good to listen to great information help me a lot to have a more balance view thanks.,2021-09-28T15:55:35Z,Roly Tremblay,https://yt3.ggpht.com/ytc/AKedOLRRgmvWwhWKTMf2aprOChRyeDyn0z8T6eccdAqC=s48-c-k-c0x00ffffff-no-rj
Ugyu84q1yU5A-RxdOcd4AaABAg,0,vN30emwcNS4,"Thank you so much for making this video Dr. Seheult. I wasn't feeling well for weeks and actually thought I had  Covid but was afraid to get tested. I came across this video and followed the recipe, I now feel so much better after weeks of taking the supplements. Now I had the courage to see my doctor and she said my lungs are good, and I want to add that I am at the high risk level too, so you can imagine how afraid and how worried  I was, I probably would of gotten worse if it wasn't for this video. I was so against the vaccine but after this scare I decided to get vaccinated now that I feel well again.",2021-09-27T10:59:09Z,Linda Smith,https://yt3.ggpht.com/ytc/AKedOLQ5QUZ9fvLP_v6Nt9IqG5ggITLxUl-RzpqtWQ=s48-c-k-c0x00ffffff-no-rj
Ugxq8M4rUjwIxbpRsf54AaABAg,0,vN30emwcNS4,Thank you for this video I wish doctors would stop acting like vitamins and home remedys do nothing theyre a thing for a reason I felt amazing after a hot bath and cold shower and take all the vitamins reccomended,2021-09-27T03:09:54Z,Emperor,https://yt3.ggpht.com/ytc/AKedOLSPm9v1veGQ0V8jJSxpWdWM9_B3wL0jINuusZ6kFw=s48-c-k-c0x00ffffff-no-rj
UgzeJ1Pt8Va3mi8wPOx4AaABAg,0,vN30emwcNS4,So I'm on day 6 of covid and offered monoclonal antibody infusion of bamlanivimab but I'm really anxious about taking it what should I do I'm feeling pretty well now with 02 lvl at 95-97,2021-09-26T19:08:45Z,ron belcher,https://yt3.ggpht.com/ytc/AKedOLQQoOtXJZ8VT6qHdM92R13hvK78l4oylXX5wQ=s48-c-k-c0x00ffffff-no-rj
UgzytGY5TGvzB7zuJL54AaABAg,0,vN30emwcNS4,Excellent explanation and thank you,2021-09-26T18:53:37Z,Anna Schae',https://yt3.ggpht.com/ytc/AKedOLRVMFSOPTGTyRO7dlfW4VP_xY9Dd3l6I0Vw4Q=s48-c-k-c0x00ffffff-no-rj
Ugxj_QG3ZdUsVxdf2zl4AaABAg,0,vN30emwcNS4,Thank You for info,2021-09-26T18:18:13Z,Brenda,https://yt3.ggpht.com/ytc/AKedOLRGw2eKo2pyRzH11zd2nqlVJAOfVLONLeibLL0zSHef_jtlas4frzbj271am-Nm=s48-c-k-c0x00ffffff-no-rj
Ugz3-0D4aZrLfzMb3Sh4AaABAg,0,vN30emwcNS4,There’s so many forms of magnesium! Which is best here for covid?,2021-09-25T23:20:40Z,Top Slot Mama,https://yt3.ggpht.com/69ViX5NPtEONZqyL9iK3mWwJoeFQgmvwwfZoG2RsyR8s_sl7PI9NxW3lgxoXn7A_P8K6uNf0Ig=s48-c-k-c0x00ffffff-no-rj
UgxF8wiB9A7U7KRkzRJ4AaABAg,0,vN30emwcNS4,What a great video!!!,2021-09-25T17:28:45Z,Ursula Conroy,https://yt3.ggpht.com/ytc/AKedOLTtCAfaNPTdfK_DnKsBeiS4oJrQ9Mbm1A8cZTtGpQ=s48-c-k-c0x00ffffff-no-rj
UgzjznxmSdD-9qAzCSZ4AaABAg,0,vN30emwcNS4,Glad i came across this video. I just tested positive so hurtful about it. This video was definitely informative 🙏🏽👍🏽,2021-09-25T13:05:39Z,Vonna B,https://yt3.ggpht.com/ytc/AKedOLQ3rr_o_m1PkIpcS4sZtQ7FOOtUIz8Oulvsm-allw=s48-c-k-c0x00ffffff-no-rj
Ugw1KcDdUjFX4snaIFJ4AaABAg,0,vN30emwcNS4,"I love the info about hyperthermia. My dad's treatment for fever has long been to take a hot soak as long as possible, then quickly drying off and jumping into bed with lots of blankets. Basically, sweat out the fever, and it works!",2021-09-23T18:53:43Z,Mama Cc,https://yt3.ggpht.com/ytc/AKedOLS8Zi7JK9CXttKvD9FBiDJSmEdW5exyWIUfBQ=s48-c-k-c0x00ffffff-no-rj
UgwmzfVeNyritH8msr54AaABAg,0,vN30emwcNS4,"Great knowledgeable evidence. Thank you! As a registered nurse, I would like to say, you have explained the content in a way that all people can easily understand. Great Job! Thank you for being truthful thank you so much.",2021-09-23T15:44:08Z,Kari Sewell,https://yt3.ggpht.com/ytc/AKedOLSsyPlfFfrKoFUIwWNSaCx3nDq5YdD2T62Lg7n9y7s=s48-c-k-c0x00ffffff-no-rj
Ugzj4C84qmo7nLtLC5J4AaABAg,0,vN30emwcNS4,"I had COVID for 10 days, then it turned into COVID pneumonia. Stayed in the hospital 10 days. Had to be on oxygen for a couple weeks after I was released. I wish I had this information when I first tested positive. I may have been able to stop it from getting as bad as it did.",2021-09-22T10:51:15Z,Bird's Garage,https://yt3.ggpht.com/ytc/AKedOLTEuwn6Jz-9r3JqvKTK8PaOMbKyEMK3TSt_yw=s48-c-k-c0x00ffffff-no-rj
UgxQbfICrq7i0LRBEtl4AaABAg,0,vN30emwcNS4,"Both me and my gf (low risk, healthy af) got covid last month. We were both taking all the supplements recommended except for NAC. First night was fever, chills, sweating. No sleep but complete exhaustion as I felt like I was in green hell.  Exhaustion lasted for 4 days. The fever lasted for 7 days. Coughing here and there for 3 weeks.  I was able to get body aches and fever under control with acetaminophen and ibuprofen 3x daily. Perhaps body aches and persistent fever symptoms due to cytokine storm? Anyway, this allowed me to get sleep -- the best medicine Im allowed in Phascist Utopia. 4 weeks later I am 100%. Thank you, Doctor!",2021-09-22T05:12:50Z,MrLIVELINESOLUTIONS,https://yt3.ggpht.com/ytc/AKedOLQQkJ1zGR7d5aMg6vsXSTKmjrCXaFcoiv3366SS=s48-c-k-c0x00ffffff-no-rj
UgzUmHoyvg4qR1XpK7F4AaABAg,0,vN30emwcNS4,Hello I have a question so I went to the store to look for vitamins D but I can’t find it there’s no way they only have vitamin d3 not vitamin D,2021-09-21T23:03:06Z,2 Krafty Sisterz,https://yt3.ggpht.com/30fKABRSiNxdAfRP65F9HPjbUai7zpc7rCpU6xAlg7o5m3kwYvyZKzSB6Co4fezHGugjSceP=s48-c-k-c0x00ffffff-no-rj
UgzUmHoyvg4qR1XpK7F4AaABAg.9S_-G-xZD3E9T5MSCLOqXY,UgzUmHoyvg4qR1XpK7F4AaABAg,vN30emwcNS4,D3 is vitamin d. It’s ok,2021-10-04T22:00:40Z,MedCram - Medical Lectures Explained CLEARLY,https://yt3.ggpht.com/ytc/AKedOLS8kzx5BL5vju2efLnrB6zyBh053ETraTOukM9dfQ=s48-c-k-c0x00ffffff-no-rj
UgzWo8f0Xe0au8R30RF4AaABAg,0,vN30emwcNS4,"This is like bitcoin, better than gold.  Thanks",2021-09-21T14:34:19Z,dazisgud,https://yt3.ggpht.com/ytc/AKedOLRMiFlU7WBNl6yd78EpUEUjeUg7g4WOq5kKMw=s48-c-k-c0x00ffffff-no-rj
UgzB9FAs2qmj4G52hAt4AaABAg,0,vN30emwcNS4,Much better information and advice that the CDC saying “ wait til your lips turn blue to get medical help.”,2021-09-21T05:26:41Z,DIVERGENT Senior,https://yt3.ggpht.com/UCbQYEKynnJb1zXR8aGRDLFRf8jzLvaTamXs59A-0fEJoK1vWRGODMC8dj8ecNqiseoW6KYlnKQ=s48-c-k-c0x00ffffff-no-rj
Ugxvcxt2ELx4QP-EI-p4AaABAg,0,vN30emwcNS4,Can I do hydrotherapy with a temp of 100.8?,2021-09-20T23:11:30Z,Rebecca McDowell,https://yt3.ggpht.com/ytc/AKedOLR2t0j2jGgp7uI1QkedQOrjwuyg76RLEMTKgw=s48-c-k-c0x00ffffff-no-rj
UgxEaOpDz3CMXvscURt4AaABAg,0,vN30emwcNS4,"Good morning Dr, my question is can I re infect someone in the same household who is currently recovering from the same variant",2021-09-20T15:38:22Z,Lunise Cesar,https://yt3.ggpht.com/ytc/AKedOLTEnmVd8rBix59d0kjPWKuW89hNLsevOczDrQ=s48-c-k-c0x00ffffff-no-rj
UgxEaOpDz3CMXvscURt4AaABAg.9SWcZo76o4l9T5MVA2Rkp_,UgxEaOpDz3CMXvscURt4AaABAg,vN30emwcNS4,Unlikely,2021-10-04T22:01:05Z,MedCram - Medical Lectures Explained CLEARLY,https://yt3.ggpht.com/ytc/AKedOLS8kzx5BL5vju2efLnrB6zyBh053ETraTOukM9dfQ=s48-c-k-c0x00ffffff-no-rj
Ugx6kBMXotZ5rn7CGD54AaABAg,0,vN30emwcNS4,"As someone once said, when you reach the hospital with this disease you're effectively at ""the end of the line"" - especially when you're intubated in the ICU.
Great channel!  Thanks for all your information and content.",2021-09-19T22:39:01Z,Mario Dalla Riva,https://yt3.ggpht.com/ytc/AKedOLTOuZBqDRou6aksLmnkknOvd2YHohiRmiBQyA=s48-c-k-c0x00ffffff-no-rj
UgyC5csa9EAU7YQAiMt4AaABAg,0,vN30emwcNS4,This was so helpful.,2021-09-19T20:34:16Z,Ruth Blackwell,https://yt3.ggpht.com/ytc/AKedOLSfDzaeViSuCpriGQ724M26Irczlwa5Ki_ZpA=s48-c-k-c0x00ffffff-no-rj
Ugxt6iooWkUyX4BjqDZ4AaABAg,0,vN30emwcNS4,Thank you so much for sharing  great informations. God bless. 🙏❤,2021-09-19T19:42:03Z,Farzaneh P,https://yt3.ggpht.com/ytc/AKedOLTbjcfCZqWs33gFYXinGEqZeep-4wzb79YvYxNtHQ=s48-c-k-c0x00ffffff-no-rj
UgzSCuCfOIEuFl2x7jl4AaABAg,0,vN30emwcNS4,I would love for him to have taught me in school,2021-09-19T03:35:54Z,heidi burns,https://yt3.ggpht.com/ytc/AKedOLSrh-s3HZbK6ZJGQnWHa-Zqjt4byYUNX9romEcu=s48-c-k-c0x00ffffff-no-rj
UgzqcWolWAaMzNVWYbp4AaABAg,0,vN30emwcNS4,.....Thankfully some useful information.,2021-09-18T23:13:17Z,MrsSlocombes PuddyCat,https://yt3.ggpht.com/XpgU1E16EymNbRyCMR7OweCceVFa_eakEYu7B8sesEeLxf1Zqk6M_4M4Efg1J19fHHxfY6J9nA=s48-c-k-c0x00ffffff-no-rj
UgzsqarMlqfrwhHKkud4AaABAg,0,vN30emwcNS4,This is so interesting. Thank you for explaining this illness and helps.,2021-09-18T13:51:01Z,Peaches Stevens,https://yt3.ggpht.com/ytc/AKedOLRaIkWOHIDYXd8_so8_bEJAtBJBD2HzrUlQE_6kuXLhwfSZDn7onh3cF7dd5cu8=s48-c-k-c0x00ffffff-no-rj
UgymjGT3FlqvtD2xslJ4AaABAg,0,vN30emwcNS4,What is NAC?,2021-09-16T20:23:00Z,Maggie Patterson,https://yt3.ggpht.com/ytc/AKedOLSsQmfWTHWbnENvayYv72XQNPnVWOjap-4hTA=s48-c-k-c0x00ffffff-no-rj
Ugys-48cz5-_n3lmUY94AaABAg,0,vN30emwcNS4,Thank you very much for this wonderful public service you have provided. You are a true healer,2021-09-16T19:09:36Z,John Shadow,https://yt3.ggpht.com/ytc/AKedOLTi1f5ET-wR4HAiPIUuK8bEkmRli607ZMTcXQ=s48-c-k-c0x00ffffff-no-rj
Ugz9-aYRScClS8xAWBd4AaABAg,0,vN30emwcNS4,"Thank you very much, I learned a lot!",2021-09-16T08:42:31Z,Judith Reynolds,https://yt3.ggpht.com/ytc/AKedOLSVuPG-xtZ4F-_v3PMXCQeZDUHm_CDJCzjAAw=s48-c-k-c0x00ffffff-no-rj
Ugypz7UQmONXvQB6O9J4AaABAg,0,vN30emwcNS4,If someone under 50yrs old contracted covid would it be beneficial to take monoclonal antibodies or hydroxychloroquine  n z pack?,2021-09-16T02:34:47Z,HighestVirtue,https://yt3.ggpht.com/ytc/AKedOLSkq3xkZQwrRS55TKPlXhle88gX3btYXJYl3i2q2w=s48-c-k-c0x00ffffff-no-rj
UgzTqth0ctZBdSUy67B4AaABAg,0,vN30emwcNS4,Thank you so much...,2021-09-15T23:34:23Z,Westthug Ridaz,https://yt3.ggpht.com/ytc/AKedOLTVyP6PsLHupPeEk-RjMX7a7fhK_c0d3WtRRA=s48-c-k-c0x00ffffff-no-rj
Ugy4Mz9eBFT6ozYQBAN4AaABAg,0,vN30emwcNS4,great video,2021-09-15T22:13:40Z,BlackwellsTrumpetBasics,https://yt3.ggpht.com/ytc/AKedOLQgGBdtbs15oYjC9EM61x681V6HCtYjh_m98N_i=s48-c-k-c0x00ffffff-no-rj
UgzTgpVRMLD4Kroy6LZ4AaABAg,0,vN30emwcNS4,"Cool info, only one comment, it is better to be proactive rather than reactive. Vaccinate! Save yourself but save others also.",2021-09-15T17:40:53Z,Marissa Aquino,https://yt3.ggpht.com/ytc/AKedOLQ_A3x3Thfu4tppRLNDHsOcf0nGvwvXD7Sx1g=s48-c-k-c0x00ffffff-no-rj
UgzMvQj36awD5BLHoah4AaABAg,0,vN30emwcNS4,Wow. Useful information.  Like REALLY useful.   Thank you.,2021-09-15T02:50:57Z,Joey Morris,https://yt3.ggpht.com/ytc/AKedOLRbjJWHUv1li_Ez8I01_37rEgqyTK9CIhC2bA=s48-c-k-c0x00ffffff-no-rj
UgxF2VqNVc2IYQRuBzd4AaABAg,0,vN30emwcNS4,"I’m 76 and in excellent health. I do not have a primary care physician. If I test positive, can I get an emergency room appointment for monoclonal antibodies?",2021-09-15T01:12:30Z,Gloria Jean,https://yt3.ggpht.com/ytc/AKedOLSc2TdjTSHYbRjS50W-_SXYRCHZYK2nSLeA1Q=s48-c-k-c0x00ffffff-no-rj
UgxAhpfkd9O3_8xYAM94AaABAg,0,vN30emwcNS4,"Mom always said fevers aren't always bad. Obviously super high ones are, but they serve a purpose.",2021-09-14T23:35:51Z,Christina Aguirre,https://yt3.ggpht.com/ytc/AKedOLS_I0P1cnFFpR8VWCWcdQ3tfrpERny9sDqGAQ=s48-c-k-c0x00ffffff-no-rj
UgyyoX7X9_AptULNQfh4AaABAg,0,vN30emwcNS4,Great info from this Doctor 👍,2021-09-14T22:30:37Z,carla89cc,https://yt3.ggpht.com/ytc/AKedOLSatZ2-BR3-lCJl475zSpjBO_RWC3cvcxg8Ww=s48-c-k-c0x00ffffff-no-rj
UgyDiT7NPMYKErYNnRl4AaABAg,0,vN30emwcNS4,Am a covid long hauler .  18 months and still recovering.  Is it safe to  take NAC if I have amalgam fillings.,2021-09-14T18:13:40Z,Shehnaaz,https://yt3.ggpht.com/ytc/AKedOLTs491SohjoOk4sfF6V3y1EaQsj9bE4Y6FU1CGYJA=s48-c-k-c0x00ffffff-no-rj
UgzowGK8qfVD6ROk3Hd4AaABAg,0,vN30emwcNS4,This is the most informative  video  I've  seen since  this pandemic  Thank You So  Much.,2021-09-14T07:51:07Z,diana codio,https://yt3.ggpht.com/ytc/AKedOLTpWWx2n1ls3S5ZL4ArUYb6w99g0XUi0merdg=s48-c-k-c0x00ffffff-no-rj
UgwqdUT2ADF1NJRpjcB4AaABAg,0,vN30emwcNS4,"I tested positive for covid Sept 4,2020.I was told to simply stay at home. I took Tylenol and a decongestant cough syrup. The strain I had killed two people. They where in the hospital. I was really sick for two and a half weeks. Thank God I haven't had it again. I'm most certain I've been around infected people since.",2021-09-14T06:04:34Z,Jennie Painter,https://yt3.ggpht.com/ytc/AKedOLQpX40Y4eYU6Q8JQSd9BRMGXm0nA-oZ0Rx_qg=s48-c-k-c0x00ffffff-no-rj
UgzpTs6jK3NytLYg4fZ4AaABAg,0,vN30emwcNS4,"I have (had) a pulse oximeter which read 92,  93 etc. it wasn’t working and when I got to the hospital, it was in the low 80’s. The doctor at the hospital told me those things were no good to use at home and that they had to be calibrated every six months or so. I was in respiratory failure!
Also I was taking vitamin D, zinc, selenium, and vitamin C. My immune system was so out of control, it attacked itself. I’m thinking I took TOO much immune building vitamins, and they had to shut down my immune  system. I was in ICU on 45 units of oxygen. I thought I was going to die.
I’m 77 and have been out of the hospital eight days. I am so thankful I survived.",2021-09-14T04:52:37Z,A,https://yt3.ggpht.com/ytc/AKedOLQvh4lx0_FJE7iZzv2P4wCXAJwBK7ipvb4EtkT-nw=s48-c-k-c0x00ffffff-no-rj
UgzpTs6jK3NytLYg4fZ4AaABAg.9SG0twOnyRw9T5MneL5Exk,UgzpTs6jK3NytLYg4fZ4AaABAg,vN30emwcNS4,Glad to see you survived!  The pulse oximeters are a guide and not perfectly accurate. If they are going down seek help.,2021-10-04T22:03:44Z,MedCram - Medical Lectures Explained CLEARLY,https://yt3.ggpht.com/ytc/AKedOLS8kzx5BL5vju2efLnrB6zyBh053ETraTOukM9dfQ=s48-c-k-c0x00ffffff-no-rj
UgzuTkT_B1y6T_W63Hl4AaABAg,0,vN30emwcNS4,I really wish that there was more information like this out there.,2021-09-14T00:21:00Z,jose felix,https://yt3.ggpht.com/ytc/AKedOLRI72ObsqAL4OFrkRj0zgcx2PngytOPqS-RxdM1Yg=s48-c-k-c0x00ffffff-no-rj
UgxtmkmQYOCW5kLSHdV4AaABAg,0,vN30emwcNS4,You guys need to update this video with a disclaimer at the beginning stating to get vaccinated. It seems multiple dinguses out there are using this video as a reason to not get the shot.,2021-09-13T19:57:51Z,vector222,https://yt3.ggpht.com/ytc/AKedOLTQAQuiRGtswyTq-Unrk6zReMTAeQ1IgjHRMRlB=s48-c-k-c0x00ffffff-no-rj
UgyJSr-M9hYobe1ZtBt4AaABAg,0,vN30emwcNS4,"Should you add the Vitamin D, C and Zink as a preventive measure or just if you get Covid?",2021-09-13T10:56:59Z,Cliffmandude,https://yt3.ggpht.com/ytc/AKedOLTUzzT3FvH6vg8MTjx-7uTvi0slHL7SdBInoPmI=s48-c-k-c0x00ffffff-no-rj
Ugz3he62rE2hlG-ZVCl4AaABAg,0,vN30emwcNS4,You'd think the government would have something like this running 24/7 on many channels.,2021-09-13T03:20:16Z,KillahManjaro,https://yt3.ggpht.com/ytc/AKedOLTP7Bp2t1HJdJx4qJLpDkOcyJo8Z2H6IGcA83RLuA=s48-c-k-c0x00ffffff-no-rj
UgyoRa-z2DWqPlbE5nN4AaABAg,0,vN30emwcNS4,Thanks a lot for this information,2021-09-13T00:38:58Z,Michael Culasing Channel - E-LEARNING.,https://yt3.ggpht.com/ytc/AKedOLQzqGHSCUg5jf1sIEKcy1ivK3Ccg_n-NWDCojOCdg=s48-c-k-c0x00ffffff-no-rj
Ugyx8WOZ9Ht325Tie1F4AaABAg,0,vN30emwcNS4,"I'm interested in the fact that this doctor said the monoclonal antibodies are giving by IV only.  Two days ago, my father, 88 years old, received Regeneron, and it was by subq injection, but followed by IV rehydration, and they did watch him for 1 hour.  It helped him initially, but then didn't seem to help much, and he was back to the ER the next day, being rehydrated.  He is still having issues, but is better than he was.",2021-09-12T07:00:11Z,Jillian Davidson,https://yt3.ggpht.com/ytc/AKedOLSjTNJs2Au4tQk1npUUeMSx_FP554BPHiDfcA=s48-c-k-c0x00ffffff-no-rj
Ugy_gyBB6vUGhyeUkSl4AaABAg,0,vN30emwcNS4,Are there any drugs on the market that can be used of label to prevent or treat covid? Are there any studies or trials being done on of label drugs?,2021-09-11T17:40:36Z,Amanda Daley,https://yt3.ggpht.com/ytc/AKedOLR_IOvgAEMS5nBRQ9AzyfqCId3qgRNEFpyr2g=s48-c-k-c0x00ffffff-no-rj
UgyxmR0bgtplADLHXw94AaABAg,0,vN30emwcNS4,What your take on ivermectin??,2021-09-11T10:10:42Z,Jay Horton,https://yt3.ggpht.com/ytc/AKedOLSMlizO6LTExwqMSIpuew9gYjsJjt1O2D6kzqzBDc5pB-fjDnPOKx-Wi9lT5tUs=s48-c-k-c0x00ffffff-no-rj
UgyqymwbGJpYYiZheLd4AaABAg,0,vN30emwcNS4,I just got vaccinated last thursday. Too bad I had sinus until the next I felt like I'm having shortness of breath. My chest feels heavy. Is this normal?,2021-09-11T09:32:43Z,Joseph Duero,https://yt3.ggpht.com/ytc/AKedOLQYQYbjCxr8HOQcZG9QdxWW3WbtwAcDNS-MHg=s48-c-k-c0x00ffffff-no-rj
UgzA5qP9QIbjPjqoIlF4AaABAg,0,vN30emwcNS4,10 year old with covid: :((((,2021-09-11T07:59:08Z,Y&L Cats for life #238,https://yt3.ggpht.com/GMwC49BUBFw5QuJSUoE6BgRpjmPV5OJRnk8XBOZLlOAt81jqG3Q2_rT3CAYke3RQPvn3N6qyMQ=s48-c-k-c0x00ffffff-no-rj
UgzSf3igVXSA8liBKwJ4AaABAg,0,vN30emwcNS4,🌹,2021-09-11T01:28:05Z,Beverly Fleming,https://yt3.ggpht.com/ytc/AKedOLTJvm2mJucnpNzX9lb6ZXRTL6myUiNh1LIko0d78g=s48-c-k-c0x00ffffff-no-rj
Ugy3gYFzImzyBjUMIOF4AaABAg,0,vN30emwcNS4,"What’s the difference between
 vit D-3 and D?",2021-09-10T18:31:51Z,Adrienne Collett,https://yt3.ggpht.com/ytc/AKedOLQmR8CSNT-xLY5QeB9a-kGcfG3LKL7PEeI4Kw=s48-c-k-c0x00ffffff-no-rj
UgyjqKqusGrBKyaVTvR4AaABAg,0,vN30emwcNS4,Can pregnant people qualify for the antibodies transfusions?,2021-09-10T12:18:14Z,S C,https://yt3.ggpht.com/ytc/AKedOLRVDSnzuzDP7-Ru8dUlIT3rP2bK6RdGFfhLew=s48-c-k-c0x00ffffff-no-rj
UgyMYl2Fpth0I6MB3th4AaABAg,0,vN30emwcNS4,"Fantastic MD doctor, knowledgeable, honest, without an agenda a totally impartial. Very good advice.!",2021-09-10T02:24:22Z,Marseille Allen,https://yt3.ggpht.com/ytc/AKedOLTWdOPz9-hOJ5SWOjxadEPIhfdAuIt1uCVGe-OC=s48-c-k-c0x00ffffff-no-rj
UgwYuIN3dUTdwZKketR4AaABAg,0,vN30emwcNS4,Thank you Doctor,2021-09-10T01:08:36Z,Phat Raccoon Landscape Services,https://yt3.ggpht.com/ytc/AKedOLTA1YxASyt_iG5tOIx5EFUPrgy1wAVyEEOtbHFuYg=s48-c-k-c0x00ffffff-no-rj
UgwHjvD0aprhjs39CaF4AaABAg,0,vN30emwcNS4,My son in law took Vit D zinc and Vit C for years and he has been in ICU with double pneumonia for 6 weeks from covid and was on a ventilator for two weeks and are trying to wean him on a tracheostomy he’s critical now,2021-09-09T20:07:25Z,Joan Shealy,https://yt3.ggpht.com/ytc/AKedOLTY-pI8iYJN7Ksuece5zBHCzNoVTRDYv5Eniw=s48-c-k-c0x00ffffff-no-rj
Ugw4slf5kQhkIy9IXuB4AaABAg,0,vN30emwcNS4,"Curious, why didn't you guys cover selenium when there have been studies showing correlation between selenium levels and positive outcomes including lower severe case risk.",2021-09-09T19:38:36Z,Shred Boise,https://yt3.ggpht.com/ytc/AKedOLQ8SkErJ7-VAkOe1--m5mlblaAXWv6fjzdTGa09=s48-c-k-c0x00ffffff-no-rj
UgyHcUYq3aGe13H-mfl4AaABAg,0,vN30emwcNS4,"Thank you doctors for your valuable advice. Stay naturally strong, healthy and safe, all good people. I do most things more or less right, except for so much sleep and before midnight. Can't manage that. Might try melatonin to break bad sleep patterns. I am not anti vax or anti conventional mainstream medicine or anti natural remedies because I know some of these work very well. I tried them. But I am interested in seeing which natural solutions can be backed up with hard, scientific, medical tests etc and what precautions to take to use the correct combinations and potencies of which ones to avoid potential risks of mixing remedies or overdosing on some or wasting money on useless ones or too low a dose etc. There is much to be careful about but also much good to potentially  be had from natural and time honoured old medical practices, sometimes, like these hydrotherapy treatments. I know old European peasants who practised such therapies routinely and lived to very old ages, even in poverty with no access to medical care.  They swore by them.",2021-09-09T11:28:47Z,Anne Marie May,https://yt3.ggpht.com/ytc/AKedOLRt4kmjdbtLMas1feROYEfq_hDLCmfe3ABBHLeTcdP0toH8A0MH7bXTCcUCdx_s=s48-c-k-c0x00ffffff-no-rj
UgzyfqbyuKAjFi2ujDB4AaABAg,0,vN30emwcNS4,"Thanks Doctor for all the information you have shared with us. Since 1998, My family has been taking vitamins ABD C with Horseradish (useful for people with Sinus and Hayfever),  B12, probiotics, Magnesium which has Calcium in this supplement.  We also have a glass of warm water with 1 teaspoon  Honey and a few sprinkles of Ginger n cinnamon powders. As soon as we wake up we drink a glass of hot water (not burning or boiling) as a cleansing process of our digestive systems.  We also are very careful with throat infection. We don’t just ignore and delay in treating our throat infection. One slight delay will worsen the mild symptom of Corona virus. We have learned from past mistakes.. We drink lots of warm water and avoid eating deep fried and oily food, and no cold drinks.  We have been using these methods and our family members stay healthy.  We have two grown up youngsters with history of Asthma. They have outgrown asthma but are still very cautious about taking the right diets, and warn drinks.  Good Ventilation in our home  is ultimately important.  I have noticed most offices have no ventilation and employees never open their windows, Early morning before they start work. Just imagine the day before, the offices are all filled with stale carbon dioxide exhaled by everyone on the premises. The following day, everyone going into the workplace will be inhaling all the stale air.  This process is repeatedly taking place every day without the stale air being cleansed..",2021-09-09T09:08:47Z,Bojoon Dong,https://yt3.ggpht.com/ytc/AKedOLTYSh7iRjzkDR6uFCgawRA8O8e1tULlvEGZkQ=s48-c-k-c0x00ffffff-no-rj
UgyHRtvouhwhnaYPOrR4AaABAg,0,vN30emwcNS4,Thank You.🙏🏽,2021-09-09T04:58:48Z,Nyanda Nyandalous,https://yt3.ggpht.com/ytc/AKedOLREeaP11TLy53QahZ_4jEHoRVjyWsvZopztPk5Zqw8=s48-c-k-c0x00ffffff-no-rj
UgxJ4NECOzTIc_-rwmp4AaABAg,0,vN30emwcNS4,Thank you for getting this out. Finally some positive information backed by reader comments who have survived and by other Doctors who support your Video. Thanks to all for the support and testaments.,2021-09-09T01:24:30Z,Ron Armacost,https://yt3.ggpht.com/ytc/AKedOLQi6JrcckMVPnzN1VGshpCIm1iuJazbhzBYV-1mtQ=s48-c-k-c0x00ffffff-no-rj
UgwEXz2cJot3R9tLapZ4AaABAg,0,vN30emwcNS4,"In the study looking at warming the body to 103 which found monocytes were activated, were the base temperatures of the subjects controlled for or were normally 96.8 individuals responding the same?",2021-09-08T19:47:03Z,Susan,https://yt3.ggpht.com/ytc/AKedOLRWnQGcXOAaPA-CyA5o-PaGgQvjDTnf0NCjRmc0=s48-c-k-c0x00ffffff-no-rj
UgxCwVE2h9MN6n_U2zV4AaABAg,0,vN30emwcNS4,What about asking your doctor about Ambien for sleep?,2021-09-08T17:38:51Z,Chris Boone,https://yt3.ggpht.com/ytc/AKedOLSC514BrJFdqFed5gUAw8-YY1KWdlcH7EkDcg=s48-c-k-c0x00ffffff-no-rj
UgxR_X8ZfUSF0yaq77h4AaABAg,0,vN30emwcNS4,"This video deserves an Award. 
God bless you. 👌🏾👌🏾👌🏾 🥇 🥇🥇 🙌🏾🙌🏾🙌🏾🙏🏾🙏🏾🙏🏾",2021-09-08T17:24:31Z,Love and Peace,https://yt3.ggpht.com/ytc/AKedOLTlM61oEOE7eWmM9gC8en5AfHNdSwSSAo3ALXgYMg=s48-c-k-c0x00ffffff-no-rj
UgzNon5znASo2lqyIq54AaABAg,0,vN30emwcNS4,Is that treatment free? The vaccine is free.,2021-09-08T16:30:22Z,Richard Nadeau,https://yt3.ggpht.com/ytc/AKedOLS8bYV41gtkrXntZk9Tt_l0hgpm654vXRMukypy43EN7Y9hG8RuIZ8DoKxGCpVG=s48-c-k-c0x00ffffff-no-rj
UgxfyFt7ZiLzBp8O9194AaABAg,0,vN30emwcNS4,"I have gone to rewatching this video after receiving severe virus symptoms. Selftest says it's not covid, however I feel really bad, worse than all my past worst flue's. Luckily I knew where to find best sound self help advices to handle and improve my state - Medcram  channel. Thank you very much for the great work you do, Kyle and doctor Seheult. Take care yourselves and The Best wishes from the Netherlands",2021-09-08T12:11:48Z,Polina Mitrofanova,https://yt3.ggpht.com/ytc/AKedOLS3jhEY60y6VzRdlZapMXT3d0D2PY2GGvBR3g=s48-c-k-c0x00ffffff-no-rj
UgzJ5T1gibm0peotw6N4AaABAg,0,vN30emwcNS4,Seventh-day Adventist christian church has been doing the Hydrotherapyca long time ago,2021-09-08T08:09:47Z,Eugene Pelle,https://yt3.ggpht.com/ytc/AKedOLQznQYLibM1PW4Aa4NCOg0EUmnpXgQzt8dSboWoJQ=s48-c-k-c0x00ffffff-no-rj
UgzJ5T1gibm0peotw6N4AaABAg.9S0vgqJ6SXB9S5BfOiY6Jf,UgzJ5T1gibm0peotw6N4AaABAg,vN30emwcNS4,"Yes. Dr. Ruble’s correspondence regarding the 1918 flu pandemic was published in Life and Health, a Seventh-Day Adventist periodical in 1919. The history goes back to a Dr. James Jackson in New York in the 1860s or so. It was later refined by John Harvey Kellogg.",2021-09-09T23:55:06Z,MedCram - Medical Lectures Explained CLEARLY,https://yt3.ggpht.com/ytc/AKedOLS8kzx5BL5vju2efLnrB6zyBh053ETraTOukM9dfQ=s48-c-k-c0x00ffffff-no-rj
UgwUt8R44icOmRAySF54AaABAg,0,vN30emwcNS4,Great info.,2021-09-07T21:58:55Z,JoAnn Palmieri,https://yt3.ggpht.com/ytc/AKedOLSdNIgCTVDDyEEeqwAOS3MQDi7QZG89ySokCg=s48-c-k-c0x00ffffff-no-rj
UgyP9v1KPf5BEcXAjMp4AaABAg,0,vN30emwcNS4,Great info.,2021-09-07T21:58:33Z,JoAnn Palmieri,https://yt3.ggpht.com/ytc/AKedOLSdNIgCTVDDyEEeqwAOS3MQDi7QZG89ySokCg=s48-c-k-c0x00ffffff-no-rj
UgzBd2j23WmdKRCDupd4AaABAg,0,vN30emwcNS4,I am currently taking 50mg of Zinc vs your recommended 40mg. Should I decrease dosage or should I continue with the 50mg?,2021-09-07T10:29:46Z,buddy mahelona,https://yt3.ggpht.com/ytc/AKedOLSpPusf2jXgHGbhl0E7azL0sBJ4-kAZV7UoDA=s48-c-k-c0x00ffffff-no-rj
UgwQTbFMVz-Qcvlllqt4AaABAg,0,vN30emwcNS4,Brilliant info 👍,2021-09-07T05:15:37Z,Rox Close,https://yt3.ggpht.com/ytc/AKedOLTa2Ph8lUQWehCqSYTE2Kq4b9BfRHX69qC5hA=s48-c-k-c0x00ffffff-no-rj
UgwbyB6mzhXFb2j7TA14AaABAg,0,vN30emwcNS4,Thank you for the great information. My regular Doctor needs to watch this.,2021-09-07T03:36:26Z,Cornelia Criddle,https://yt3.ggpht.com/ytc/AKedOLSqHIF-_xtdyccE1G_2Rd1DG9VeOBb5TvAVujAcbg=s48-c-k-c0x00ffffff-no-rj
UgzOVpeURWvU72Itmf54AaABAg,0,vN30emwcNS4,Good luck my fellow sick people.,2021-09-06T18:35:39Z,Kangaroo Ninja,https://yt3.ggpht.com/ytc/AKedOLS-Q9BvYR6r-xQ-oAS_4cFvN954Mln0SpkVFWGQ=s48-c-k-c0x00ffffff-no-rj
