commentId,parentId,videoId,textDisplay,publishedAt,authorDisplayName,authorProfileImageUrl
UgyZucbcVZ14Nv7oXwp4AaABAg,0,vN30emwcNS4,CNN reported the pulse oximeter does not read correctly for blacks. Suggest higher level of oxygen when administeted.,2021-03-17T13:18:49Z,Annette Arties,https://yt3.ggpht.com/ytc/AKedOLThQT9IcdaooISgpmeHcMNTdRWV0fT4LIL-hA=s48-c-k-c0x00ffffff-no-rj
UgyZucbcVZ14Nv7oXwp4AaABAg.9Kzrx8BH3GZ9LAqZ8xqhmc,UgyZucbcVZ14Nv7oXwp4AaABAg,vN30emwcNS4,They are correct. It’s a few points off.,2021-03-22T04:57:33Z,MedCram - Medical Lectures Explained CLEARLY,https://yt3.ggpht.com/ytc/AKedOLS8kzx5BL5vju2efLnrB6zyBh053ETraTOukM9dfQ=s48-c-k-c0x00ffffff-no-rj
UgxZJOwWeM-VdhwJDUZ4AaABAg,0,vN30emwcNS4,all good but don't forget about Ivermectin!,2021-03-17T11:16:04Z,Sorin Gociu,https://yt3.ggpht.com/ytc/AKedOLRpWQQXvMdiFjgJO1cmXpzrn6uiIUfHnaCQJn18YA=s48-c-k-c0x00ffffff-no-rj
UgwJKQdBPvv-0vNgBIV4AaABAg,0,vN30emwcNS4,Very informative !,2021-03-15T12:28:11Z,Lakshman Rao,https://yt3.ggpht.com/GMp27SsJ1e-hObrF_IniYw2D20TdTZeWoZNKm43QoZH4jDXLfLzj_strHCoTGk8Sl6jhx9nC=s48-c-k-c0x00ffffff-no-rj
Ugx30iuwECHTljGBF8V4AaABAg,0,vN30emwcNS4,great video Bless you sir.  Im doing all the above and this was very helpful in confirming,2021-03-15T11:04:21Z,Joseph Abdo,https://yt3.ggpht.com/ytc/AKedOLSLjB-hW3uCXgK7dJy8QNUhcBUEVl0MDn8i0Q=s48-c-k-c0x00ffffff-no-rj
UgxoacrZDp-P6QINKhJ4AaABAg,0,vN30emwcNS4,"OUTSTANDING.
THANK YOU!❤️",2021-03-15T03:41:46Z,West Coast,https://yt3.ggpht.com/55H8DGAXYbrAbCG72NSCu5AhthzRmxhBUF1LJuV9Lp54okT7-qnADgZTaHtxItzrDTdlVxEP=s48-c-k-c0x00ffffff-no-rj
UgxoacrZDp-P6QINKhJ4AaABAg.9KtgK-PqJNC9KuasxIsPz6,UgxoacrZDp-P6QINKhJ4AaABAg,vN30emwcNS4,You are so welcome!,2021-03-15T12:13:29Z,MedCram - Medical Lectures Explained CLEARLY,https://yt3.ggpht.com/ytc/AKedOLS8kzx5BL5vju2efLnrB6zyBh053ETraTOukM9dfQ=s48-c-k-c0x00ffffff-no-rj
Ugwbf9MNIAgQsS1Zo494AaABAg,0,vN30emwcNS4,Good video,2021-03-14T11:58:52Z,gruv2nz,https://yt3.ggpht.com/ytc/AKedOLSAOdh9qT-uzAvuqGO8W6v_0FX5gBz4u0v1R3SM=s48-c-k-c0x00ffffff-no-rj
UgxsM0zINmttuETCwZx4AaABAg,0,vN30emwcNS4,"Excellent advice🙏🏻I have been a member of Life Extension Foundation for over 40 years. Nutrition and boosting up one’s immune system is the golden key.
Thank you for such video’s .🙏🏻",2021-03-12T06:11:31Z,Sujata Holliday,https://yt3.ggpht.com/ytc/AKedOLSWJ1UFJiGdmdavP8AosIMTmfvJAoN09bsN0gketA=s48-c-k-c0x00ffffff-no-rj
Ugz5Kg4CFq4wuAgdcI94AaABAg,0,vN30emwcNS4,"Thank you doctors for the well needed information about the Covid 19  viral infection and how to 
help to take care of ourselves prevention wise and if we get infected. I’m very grateful indeed",2021-03-12T02:28:45Z,Venice Bernard-Wright,https://yt3.ggpht.com/ytc/AKedOLTB8-Dn4XY8a0NL5pjG7i-7pKdgnXiXvYJk8kQI8g=s48-c-k-c0x00ffffff-no-rj
UgxzorKoxfqH_8eYxZF4AaABAg,0,vN30emwcNS4,you 2 men gave the best explanation & advice I have ever read ..thank you guy so much for all that info I plan on watching your other videos  thanks you 2 men are excellent,2021-03-10T14:45:56Z,Marlene Cesarotti,https://yt3.ggpht.com/ytc/AKedOLRAaAjw54aOC5DfKNyP41FzT9ibda-u6vAFRg=s48-c-k-c0x00ffffff-no-rj
UgyTp7QQ771cnCYTZOR4AaABAg,0,vN30emwcNS4,excellent info thanks to you 2 men I have a oximeter & read 99 so that was good & I will take extra D3  you are the best than that Falci who just confuses everyone....THANKS AGAIN,2021-03-07T21:56:47Z,Marlene Cesarotti,https://yt3.ggpht.com/ytc/AKedOLRAaAjw54aOC5DfKNyP41FzT9ibda-u6vAFRg=s48-c-k-c0x00ffffff-no-rj
Ugw30EZXSkbVSdxvEKJ4AaABAg,0,vN30emwcNS4,Thanks Dr,2021-03-07T16:48:59Z,Coleen Robinson,https://yt3.ggpht.com/ytc/AKedOLTCKDsEcgX9NlAVWiRwEejBDuZFkkBI22lgUA=s48-c-k-c0x00ffffff-no-rj
Ugx1sAm_sJiEmv7dCO14AaABAg,0,vN30emwcNS4,I'll bet just sweating from a jog or some sort of exercise would work as well👍. Can't hurt.,2021-03-04T14:11:35Z,Jojo Gurl,https://yt3.ggpht.com/ytc/AKedOLSuJpiyMDDwUlLrdHRfY5AYfCuKa9X67JuuJ5Alzw=s48-c-k-c0x00ffffff-no-rj
Ugy6eOkLy1O385QKXSt4AaABAg,0,vN30emwcNS4,Thank you and God bless!,2021-03-03T03:04:04Z,Marife de Luna,https://yt3.ggpht.com/ytc/AKedOLSz1IpWXfLoIB4QuO6_19jyuQNfOFdRbUPoeJLVgz4=s48-c-k-c0x00ffffff-no-rj
UgxGUBlYPs4kA9eGhNZ4AaABAg,0,vN30emwcNS4,Thanks for this valuable information.,2021-03-02T04:30:56Z,Bridgeoverthevalley,https://yt3.ggpht.com/ytc/AKedOLTs6_0mDPOQB0lGqyZjlC52BiA2bAPAADxAuTM=s48-c-k-c0x00ffffff-no-rj
UgzXVdBzXQsNcpjorfV4AaABAg,0,vN30emwcNS4,he should make an ebook,2021-03-02T01:53:32Z,Rita Taylor,https://yt3.ggpht.com/ytc/AKedOLTEJM9LOVSY3KYXr2TsQ3TSYPQ9fA7vfGwowoVB5Q=s48-c-k-c0x00ffffff-no-rj
UgzU4VNn8wrIZ1wikKB4AaABAg,0,vN30emwcNS4,Thank you very much Doc. God bless you.,2021-03-01T16:04:22Z,Harold Sanchez,https://yt3.ggpht.com/ytc/AKedOLR9R0JgBJ2s1wiYgmrMObtO-m7smBzCZSa_1nPIuQ=s48-c-k-c0x00ffffff-no-rj
UgzY1JPsxHVqYErnUEd4AaABAg,0,vN30emwcNS4,Doctor thank you you so very kind for helping patients life,2021-02-28T02:12:10Z,Sandy Ia Her,https://yt3.ggpht.com/ytc/AKedOLSevZNPSH7QELfOs5Zyh8DDyFQw_nW5NMKrPgxM-iEq4wU0axjsgZRhf36Wj-ml=s48-c-k-c0x00ffffff-no-rj
UgyhRvWx_zxiyYx3DNd4AaABAg,0,vN30emwcNS4,Thank you Doctor you so kind,2021-02-28T02:10:00Z,Sandy Ia Her,https://yt3.ggpht.com/ytc/AKedOLSevZNPSH7QELfOs5Zyh8DDyFQw_nW5NMKrPgxM-iEq4wU0axjsgZRhf36Wj-ml=s48-c-k-c0x00ffffff-no-rj
UgzK5R2Fr26F3TdEe414AaABAg,0,vN30emwcNS4,That was fantastic ...  thank you so much.,2021-02-25T09:58:18Z,Angela Rudge,https://yt3.ggpht.com/ytc/AKedOLQbtwNqmRi5KxFA8kjlJMQkQsuO2NVm6ipc9jQ5jw=s48-c-k-c0x00ffffff-no-rj
UgwJ87VUMb0S20ihmad4AaABAg,0,vN30emwcNS4,Kudos for this excellent practical video! This answered so many of my questions! Thank you very much for sharing this! God bless! ❤️🙏,2021-02-24T10:49:29Z,C A,https://yt3.ggpht.com/wYKJrnw5SJYmpy82d6L7_rAFjOxOCOj0h9D0bPn9puZiSu_JujUAy0sl0agh7CnQv3SxW8ZX72w=s48-c-k-c0x00ffffff-no-rj
Ugx43ds70V0BQLvNTKN4AaABAg,0,vN30emwcNS4,Do gargles with oropharyngeal yodopovidine solutions or Listerine help to diminish virus in oropharynx?,2021-02-24T04:48:44Z,Teresa Wolff,https://yt3.ggpht.com/ytc/AKedOLTif3zg6601-fxH7DTnZ1bJLcEJzbh1kHg-2g=s48-c-k-c0x00ffffff-no-rj
UgxgtdFjg8KWd5iddal4AaABAg,0,vN30emwcNS4,You are a treasure for the world,2021-02-23T22:06:50Z,Enio Tanaka,https://yt3.ggpht.com/ytc/AKedOLS80ckW0KqJndLP2v9WEiTV5XciGlzoE7x11oGJww=s48-c-k-c0x00ffffff-no-rj
UgyQ7nezCL-5tJz8Ns14AaABAg,0,vN30emwcNS4,Please make a video on Sinopharm vaccine.,2021-02-23T06:23:46Z,Shah Ali Baloch,https://yt3.ggpht.com/ytc/AKedOLQtFcb4Qm8tGcf0PMR_gQAOB74l0a0D0k-Ub3yr=s48-c-k-c0x00ffffff-no-rj
UgyA0ZR8LP-fOwtLwIt4AaABAg,0,vN30emwcNS4,I love this.  Great information!!,2021-02-22T19:26:09Z,patriciaae99,https://yt3.ggpht.com/ytc/AKedOLRVnrA94YPuZZ-hG6l29V2Pwnotz0_kj01ujTJh=s48-c-k-c0x00ffffff-no-rj
UgyQreKSe7OpZNsdnJB4AaABAg,0,vN30emwcNS4,"Great information Doc. , can you please advice if a person with Thyroid problem specifically Hypothyroid and on medication is allowed to take NAC at all ? if yes then would the doses be the same 600 mg / 2 times a day ?
also can we take L-Lysine 2000 mg along with NAC for better immune support ?",2021-02-22T18:50:33Z,mike Anderson,https://yt3.ggpht.com/ytc/AKedOLTctOzUYc3QDFxwoyw-WhJuyuPO4FfWtlDk2g=s48-c-k-c0x00ffffff-no-rj
UgxriGuScwYwAktuFnh4AaABAg,0,vN30emwcNS4,Is it possible that night sweats affect interferon level  positively?,2021-02-21T14:10:54Z,Martine Jezo,https://yt3.ggpht.com/ytc/AKedOLS8ZVBoasKMI_Gk9rfVrvVDByYxWkMO0KYn=s48-c-k-c0x00ffffff-no-rj
UgwjyAuEje_ie9TUsBp4AaABAg,0,vN30emwcNS4,Thank you for this wisdom.,2021-02-21T08:31:06Z,John Payne,https://yt3.ggpht.com/ytc/AKedOLQx7OkuAdV6oQ0cYdSUe3yOAIao0qqrBG7k8tHOSg=s48-c-k-c0x00ffffff-no-rj
UgzrTvO6l59l3TNOyiN4AaABAg,0,vN30emwcNS4,How long is too long to have cough?I have cough for 20 day,2021-02-21T03:59:57Z,Sal Saldana,https://yt3.ggpht.com/ytc/AKedOLQpRovX7AybEPZBC9x1gxUcH-8Yyg9lz0otpg=s48-c-k-c0x00ffffff-no-rj
Ugx4NS-XSc48AOL9_Ph4AaABAg,0,vN30emwcNS4,"Thank  for this  important information,
.
Atleast  some Doctors  are doing their  jobs  right, vitamin D must be the Mian topic in  Media ( not vaccine)",2021-02-19T02:46:49Z,Blau Grün,https://yt3.ggpht.com/ytc/AKedOLS9rHlTT_5JW_msMzGX4xj5UdfWcPVbAK-9IPmb=s48-c-k-c0x00ffffff-no-rj
UgyN7oAFY4tljpyVp3V4AaABAg,0,vN30emwcNS4,Thankyou! Finally a real solution for covid19.,2021-02-18T21:20:59Z,Luis Jaramillo,https://yt3.ggpht.com/ytc/AKedOLRCWM6tPvu5yfCTC7cG585kMEUNLTWPapDm8Q=s48-c-k-c0x00ffffff-no-rj
Ugw0fHtGFXbTXz5uZs14AaABAg,0,vN30emwcNS4,10pm-2am the most important hours of sleep,2021-02-18T16:27:14Z,Frank Critelli,https://yt3.ggpht.com/ytc/AKedOLQE87SD9rDrNEOMivuvpmRNhCO5Umhe_PNIKQ=s48-c-k-c0x00ffffff-no-rj
UgztmxVkgfCC8Ebphb54AaABAg,0,vN30emwcNS4,What is sarcoid?,2021-02-18T04:34:28Z,Bill Wilhite,https://yt3.ggpht.com/ytc/AKedOLToyvhmzjn8EQVgy-6ltyq1sb0w4DteCO0Y7g=s48-c-k-c0x00ffffff-no-rj
Ugyx4iaxXtc3MJes7xh4AaABAg,0,vN30emwcNS4,what foods will increase my zinc?,2021-02-17T18:30:44Z,George Daniel Mackey,https://yt3.ggpht.com/ytc/AKedOLQkSleW0zsWglpjGVHXPe77wHtIj5BroXdjaVdSXQ=s48-c-k-c0x00ffffff-no-rj
Ugw2BmdqpcdF1qx-pw94AaABAg,0,vN30emwcNS4,Been taking vitamin D and C forever.  Been using Zinc from early days of Covid.  I got covid never had so much as a sniffle.  my wife who takes same regimen remained negative.,2021-02-17T03:32:02Z,Charles,https://yt3.ggpht.com/ytc/AKedOLRF0g3r3ZEf4aJWjGILoLofvYSL37Q4t3re5gkymg=s48-c-k-c0x00ffffff-no-rj
Ugz4vF-QIVKdruapazp4AaABAg,0,vN30emwcNS4,"What gives better immune protection hormone vitamin D or a mRna vaccine? They both seem to trigger the same immune path. Vit D hormone seems superior as the whole system will give you antibodies to any new virus or variant or whatever that attacks you while mRna vaccine will will work only for virus it was created, is that correct?",2021-02-16T20:05:12Z,Oliwia K,https://yt3.ggpht.com/ytc/AKedOLSpOkRR3_oHvwok0mkFuaSB3SLGsjWaN9NBTv_4pg=s48-c-k-c0x00ffffff-no-rj
UgzJM1o-3uGlML5PDQh4AaABAg,0,vN30emwcNS4,Heat therapy would be worth trying for Lyme disease.,2021-02-16T19:12:09Z,Physiocrat,https://yt3.ggpht.com/ytc/AKedOLRW8s4IAauLRNhDBUPuJatnZXsZt1fK-IrZS4L_=s48-c-k-c0x00ffffff-no-rj
UgytNwnaizDaBaUT9ah4AaABAg,0,vN30emwcNS4,"What is the difference between a vaccine and hormone vitamin D, they seem to trigger immunity exactly the same?",2021-02-16T18:10:28Z,Oliwia K,https://yt3.ggpht.com/ytc/AKedOLSpOkRR3_oHvwok0mkFuaSB3SLGsjWaN9NBTv_4pg=s48-c-k-c0x00ffffff-no-rj
UgzUHKZyDSWX497Vyc14AaABAg,0,vN30emwcNS4,"I have been exposed SEVERAL times to people with covid-19 even on a car trip without getting sick.....I take 5,000iu Vit. D and zinc daily.   Common Sense mask-wearing, hand-washing, disinfecting of services Etc.... also play a big role",2021-02-16T03:51:19Z,Ander Ander,https://yt3.ggpht.com/ytc/AKedOLQL7ZHKiv6CE0YMJ-rNTCsw1O1u_tYSuttTkJ77vIioD7brTE17oWVIOCq7pgIn=s48-c-k-c0x00ffffff-no-rj
UgwystrUBAg35RHCA4N4AaABAg,0,vN30emwcNS4,"Hi MedCram, I like your content. I love watching your videos.",2021-02-15T16:09:49Z,Joyleen Strozier,https://yt3.ggpht.com/ytc/AKedOLRQt6xRIQHxPbnCsj6_u9ZXC0XrQpPBBVZ-Yg=s48-c-k-c0x00ffffff-no-rj
Ugz_eKTBTLtGY8pQWZN4AaABAg,0,vN30emwcNS4,Thank you for the great information,2021-02-15T11:04:17Z,Eric Batres,https://yt3.ggpht.com/ytc/AKedOLSYImgxDMewAxJi2T02JkNt8g50HXNM_MM-FujS=s48-c-k-c0x00ffffff-no-rj
Ugw8mh9JkigHoNeUuV54AaABAg,0,vN30emwcNS4,Be careful with contrast showers because cold followed by hot is easy but hot followed by cold you can pass out. Never play alone if you can avoid it but at least put yourself on a stool sitting in your tub to prevent falling. Been there done that,2021-02-15T08:05:05Z,Yourdeadmeat69,https://yt3.ggpht.com/ytc/AKedOLR3iwggMCHyW4k2M1OutgADUxcu4qbo-C0VFA=s48-c-k-c0x00ffffff-no-rj
UgzYhlHoyd7e_IHn-Qx4AaABAg,0,vN30emwcNS4,"Could you tell me if we take 5,000 IU of Vit. B or 5,000 IU OF Vit. D3",2021-02-13T20:20:36Z,Dorothy Weiland,https://yt3.ggpht.com/ytc/AKedOLQCIcCI2-bzI4mynoSXwhaJfCEHXgobqp3GkQ=s48-c-k-c0x00ffffff-no-rj
UgzYhlHoyd7e_IHn-Qx4AaABAg.9JiDmLN0y6o9Jtl6HvaZ17,UgzYhlHoyd7e_IHn-Qx4AaABAg,vN30emwcNS4,D3,2021-02-18T07:52:12Z,MedCram - Medical Lectures Explained CLEARLY,https://yt3.ggpht.com/ytc/AKedOLS8kzx5BL5vju2efLnrB6zyBh053ETraTOukM9dfQ=s48-c-k-c0x00ffffff-no-rj
Ugx9HqtXwd5XI8D-b-Z4AaABAg,0,vN30emwcNS4,thanks very much!,2021-02-13T04:19:39Z,Miss A,https://yt3.ggpht.com/ytc/AKedOLROtWNxAOgY-KNn-p5LUe7qXg6SgwM7EPln5vgNpQ=s48-c-k-c0x00ffffff-no-rj
Ugx0o00cwiI79cv04cd4AaABAg,0,vN30emwcNS4,A great job. The most informative v'deo about prevention/treatment about C 19. Thanks both of U.,2021-02-12T15:57:19Z,Thai Malay,https://yt3.ggpht.com/ytc/AKedOLRMEU1tQTvvtGby4hkCA8ELcTfTLbfLAKRjuQ=s48-c-k-c0x00ffffff-no-rj
UgwInwzS8ushH1zbdD54AaABAg,0,vN30emwcNS4,My kids great grandmother just passed away with COVID.   She was in her 80’s.   The entire family had it and they are fine but it was definitely a rough ride.    Everyone stay safe!,2021-02-11T22:17:25Z,shadow1warrior,https://yt3.ggpht.com/NL6KCsZoyTU5kSCe8-C7fDqYw8rkcAr9JRJKUVBFoX7v-guEcmZSuKaKh_DnZy51XMePNiO3FWs=s48-c-k-c0x00ffffff-no-rj
UgzXcJ3cPEVEse2zWz54AaABAg,0,vN30emwcNS4,"I take 4-5 grams of Vitamin C daily.  When I don't take it for a few days, I don't feel as healthy.  If you  are constipated, take Vitamin C,  one gram every 6 hours until you are no longer constipated.  That's how you know you have taken ""too much"".   You get loose stools.  A godsend to constipated people.",2021-02-11T08:03:28Z,Dylanna Enzo,https://yt3.ggpht.com/ytc/AKedOLRyt_aeZQ4HlK6-Xqo6IJdQEGh4H-7PvOPN2w=s48-c-k-c0x00ffffff-no-rj
UgyzcMMTitEoj1Q4wcl4AaABAg,0,vN30emwcNS4,"There’s an old Hawaiian treatment where you grind up a pound of ginger and then make pot of strong tea.  Your pour it into a hot tub and stay in it 15 minutes, until you break a sweat.  It’s always worked for me.",2021-02-10T21:46:14Z,Auntie Social,https://yt3.ggpht.com/o6jFwDuGJvwjsJbjl0y2uud79YVLO37lWj0CCaGh96qB2_sVH7-uviui0UoWwKx7aDOrxKv6VcY=s48-c-k-c0x00ffffff-no-rj
UgyzcMMTitEoj1Q4wcl4AaABAg.9JaeBw3G7fM9JtlEeWZY0g,UgyzcMMTitEoj1Q4wcl4AaABAg,vN30emwcNS4,Seems very similar to many treatments done around the world. 👍,2021-02-18T07:53:20Z,MedCram - Medical Lectures Explained CLEARLY,https://yt3.ggpht.com/ytc/AKedOLS8kzx5BL5vju2efLnrB6zyBh053ETraTOukM9dfQ=s48-c-k-c0x00ffffff-no-rj
UgyNrnC0jQ-AOKFxn8N4AaABAg,0,vN30emwcNS4,"The doctor talked about wearing a cold towel so the head doesn't heat up but just the body, and was wondering why is it bad if the head heats up as well. And as a side note, it looks that the body knows what it's doing elevating the body temperature when we are sick so it can take action more efficiently, and many take medication for lowering the body temperature which might not be the best thing, unless it gets to a critical point above 39.5 or so.",2021-02-10T19:42:08Z,Alex,https://yt3.ggpht.com/ytc/AKedOLR6iXqH4Iy3lEyUZzWrgx73TLwlK1cVJh_jyDXfkQ=s48-c-k-c0x00ffffff-no-rj
UgyNrnC0jQ-AOKFxn8N4AaABAg.9JaR-33h7zc9JtlQaTfI9E,UgyNrnC0jQ-AOKFxn8N4AaABAg,vN30emwcNS4,Agree. Note that it is harder to heat up the body if the body knows it’s being heated up because it will try to sweat etc. by cooling the head you can fool the body’s thermostat somewhat.,2021-02-18T07:54:58Z,MedCram - Medical Lectures Explained CLEARLY,https://yt3.ggpht.com/ytc/AKedOLS8kzx5BL5vju2efLnrB6zyBh053ETraTOukM9dfQ=s48-c-k-c0x00ffffff-no-rj
UgyUTwf6Z4xEZQHrbBd4AaABAg,0,vN30emwcNS4,Please pray for my dad please,2021-02-10T14:53:26Z,IE,https://yt3.ggpht.com/ytc/AKedOLQxKNr9Nghay8wAAPXJn9gEt886hxSdHSHqL5yEbA=s48-c-k-c0x00ffffff-no-rj
UgyUTwf6Z4xEZQHrbBd4AaABAg.9J_uxYb6kEd9JtlT-6CC5N,UgyUTwf6Z4xEZQHrbBd4AaABAg,vN30emwcNS4,Done!,2021-02-18T07:55:18Z,MedCram - Medical Lectures Explained CLEARLY,https://yt3.ggpht.com/ytc/AKedOLS8kzx5BL5vju2efLnrB6zyBh053ETraTOukM9dfQ=s48-c-k-c0x00ffffff-no-rj
UgzFw2FPf0edaAjrbGd4AaABAg,0,vN30emwcNS4,Thank you. Thank you.,2021-02-10T10:57:12Z,Queen of the South,https://yt3.ggpht.com/ytc/AKedOLR8KOuZIKgMfazU9lpR9nCSOJfgImQ8MybZ4cs-=s48-c-k-c0x00ffffff-no-rj
UgzXNdAPbvOVlaWX3xB4AaABAg,0,vN30emwcNS4,Very helpful for me!,2021-02-09T22:01:03Z,Kel Dyke,https://yt3.ggpht.com/ytc/AKedOLSoTSQN1FyGy8NHB5woSCeEYBo0cx5zM7FCsYpIew=s48-c-k-c0x00ffffff-no-rj
Ugz11NkzcP9orjZi6yV4AaABAg,0,vN30emwcNS4,Absolutely phenomenal video,2021-02-09T04:11:06Z,E Johnson,https://yt3.ggpht.com/ytc/AKedOLSslPY6Nyjydl4fRkNpTD6tGA5WKWFvmRGpDTTVYQ=s48-c-k-c0x00ffffff-no-rj
UgwDJYnud5CFx7kUD3F4AaABAg,0,vN30emwcNS4,Extremely beneficial.  Thank you.,2021-02-09T01:48:27Z,VIDEOHEREBOB,https://yt3.ggpht.com/ytc/AKedOLRcj7gBk-fJMi0HEnOyCh88pQh5NDMX2UHRwg=s48-c-k-c0x00ffffff-no-rj
UgwaUPwYEhRJSp_GU514AaABAg,0,vN30emwcNS4,"Excellent videos clip,I am one of the victim who got monoclonal antibodies,from the memorial facility from Florida.I am in good shape after the infusion,68 yrs old with Diabetes,HTN,& bronchitis.thanks America,",2021-02-08T11:22:01Z,Jacob Varughese,https://yt3.ggpht.com/ytc/AKedOLSKIcIj0-SZ-ZhzZDWrj8aSzGmgXLf4JsbGXQ=s48-c-k-c0x00ffffff-no-rj
UgxLhokQ_6205XxQWW94AaABAg,0,vN30emwcNS4,Should one workout if one got covid?,2021-02-08T06:03:56Z,Just J,https://yt3.ggpht.com/ytc/AKedOLQGI-smmfpdliNVFaeO1_ELyHhHq34W24yVQA=s48-c-k-c0x00ffffff-no-rj
Ugz4dppe9ZKZCim5gch4AaABAg,0,vN30emwcNS4,WHAT IS NAC???,2021-02-08T00:30:25Z,Malva Scurry,https://yt3.ggpht.com/ytc/AKedOLRWIElTUx9_nbvOzEyakEx5R_7eWCm1T2b66g=s48-c-k-c0x00ffffff-no-rj
Ugz4dppe9ZKZCim5gch4AaABAg.9JUDaqo3AH19JVw0c90AdE,Ugz4dppe9ZKZCim5gch4AaABAg,vN30emwcNS4,N-acetylcysteine,2021-02-08T16:26:32Z,MedCram - Medical Lectures Explained CLEARLY,https://yt3.ggpht.com/ytc/AKedOLS8kzx5BL5vju2efLnrB6zyBh053ETraTOukM9dfQ=s48-c-k-c0x00ffffff-no-rj
UgxS62aP5kbcXl4RwAJ4AaABAg,0,vN30emwcNS4,"I hope Doctor Fauci sees the work you have presented during this crisis. 
I'm putting you in for the Medal of Freedom.",2021-02-07T15:30:12Z,Bill Dukacz,https://yt3.ggpht.com/ytc/AKedOLR5veM0QLO_bQDURCBTzIdFhq5QJZMR4w_FVA=s48-c-k-c0x00ffffff-no-rj
UgytirijcXVlJ5sLHZl4AaABAg,0,vN30emwcNS4,Thank you Doctor Seheult for your amazing knowledge! 👍,2021-02-07T15:27:36Z,Bill Dukacz,https://yt3.ggpht.com/ytc/AKedOLR5veM0QLO_bQDURCBTzIdFhq5QJZMR4w_FVA=s48-c-k-c0x00ffffff-no-rj
UgzxOH3TLetge-1gOrV4AaABAg,0,vN30emwcNS4,This is one of few with information that looks better than others out the now. Thank you both.,2021-02-07T07:53:47Z,L1,https://yt3.ggpht.com/ytc/AKedOLQTW97U8p33Vld7PaTkj_u3LJdWbHtCBkcwIAmX0w=s48-c-k-c0x00ffffff-no-rj
Ugxphcl9PNMBUY_phPl4AaABAg,0,vN30emwcNS4,Nice👍,2021-02-07T04:44:47Z,Firdous Ara,https://yt3.ggpht.com/ytc/AKedOLRIycwTpcIeQeSRJKW9f0I0IGc6xVWz4Ci7sDmijw=s48-c-k-c0x00ffffff-no-rj
Ugy8Rd7jC1c7VXFJl0V4AaABAg,0,vN30emwcNS4,Bless this Doctor!! Lots of valid info for all..Thank you and your mission to help!,2021-02-06T21:44:10Z,Anna Conklin,https://yt3.ggpht.com/ytc/AKedOLSWZAMB0DNtMb42xvIpEGHDjlegYNIhJl6pyQ=s48-c-k-c0x00ffffff-no-rj
Ugy6rCsgAfnrovsLJOh4AaABAg,0,vN30emwcNS4,Thank you for your incredible information,2021-02-06T12:07:05Z,Hector Mendiola,https://yt3.ggpht.com/ytc/AKedOLSOoKs9GBfGz4XO37bDWdhKxJbvkpNMEqIeHCmZwRU=s48-c-k-c0x00ffffff-no-rj
UgzlC8752ebBFmH1hyJ4AaABAg,0,vN30emwcNS4,Another strategy I read about was gargling mouthwash frequently. The idea is that it reduces the viral load at one of the main points of entry.,2021-02-06T04:52:20Z,etmax1,https://yt3.ggpht.com/ytc/AKedOLTjoRwyw587Ter0Rwqhjuk40EaCUCD7wjHGzsqt=s48-c-k-c0x00ffffff-no-rj
Ugzf5Fj7E5GY31jHD9R4AaABAg,0,vN30emwcNS4,Good advice,2021-02-06T00:06:27Z,KING CARTER,https://yt3.ggpht.com/ytc/AKedOLTJRwkLCk9-v_acANX5bNxSEDsby1YTUoOg4ssCsw=s48-c-k-c0x00ffffff-no-rj
UgwTBEHdehxeX56oLVt4AaABAg,0,vN30emwcNS4,Thank you from the UK 🇬🇧 for your detailed information. I’ve had 2 Covid tests and both have been negative! 🙏🏼🏴󠁧󠁢󠁥󠁮󠁧󠁿🇺🇸✝️👍🏻,2021-02-05T12:37:39Z,bcfc18751,https://yt3.ggpht.com/ytc/AKedOLSe6pZ8iMHXDpIDXyDwFBwvUKb6uODm0py_Kw=s48-c-k-c0x00ffffff-no-rj
UgxkkTGNP8mfKC3vX0B4AaABAg,0,vN30emwcNS4,I’m so great full for this thank you,2021-02-05T04:30:31Z,SM,https://yt3.ggpht.com/ytc/AKedOLTeA6Y3jLQCAfuqGCZTCzL6dXZwGoxaHFa5Pw=s48-c-k-c0x00ffffff-no-rj
UgyEooY6KPpElNPFIc54AaABAg,0,vN30emwcNS4,"What an awesome video! I feel 200% smarter & calmer!!
Obviously, I can't read Medical jargon, but Dr. Seheult explained the studies well. Thank you!!!🤗
Stay healthy everybody!💕",2021-02-05T03:30:46Z,Rebecca Carlson,https://yt3.ggpht.com/ytc/AKedOLSYtDmY1K4zF3woJAPnalgD_zZzqUAsgGABuqI9xA=s48-c-k-c0x00ffffff-no-rj
UgxbptZMx-TTz1OzYWR4AaABAg,0,vN30emwcNS4,"So nice to come across a channel where all the comments are positive and thankful, as opposed to the general nastiness that seems to have invaded many others!",2021-02-03T19:04:07Z,OcAy 28,https://yt3.ggpht.com/ytc/AKedOLTAPWn1fdJup_1h8HCoCvFnT4wM_i44Wiz_Xg=s48-c-k-c0x00ffffff-no-rj
UgzG1XxiiuuzrDSZqhF4AaABAg,0,vN30emwcNS4,"Had Covid19, felt terrible  for about 2 weeks, highly hydrated, emergen-c 2,000 mg a day, a lot of rest.",2021-02-03T16:09:52Z,Mama Llama,https://yt3.ggpht.com/ytc/AKedOLSNVhvvkcfpd8eUYlfXNSbteJ0ZaC5otfkiU-PshA=s48-c-k-c0x00ffffff-no-rj
UgzpF50NY0guGrlPFT94AaABAg,0,vN30emwcNS4,"This video is so informative on the prevention and early treatment of COVID 19, thank you Dr Sehult , Kyle for sponsoring, and asking pertinent questions.",2021-02-03T04:57:22Z,Herman Ng,https://yt3.ggpht.com/ytc/AKedOLSu_mj5Otm2_ToDLA77nCnIOaQDNJrlc_Fm7g=s48-c-k-c0x00ffffff-no-rj
Ugx1xgttY4cSIfnUnS54AaABAg,0,vN30emwcNS4,"Dr. Seheult,
Thank you for sharing your insights!! You’re amazing. You are truly an angel from above teaching us.",2021-02-02T20:52:11Z,njdiabeteseducation,https://yt3.ggpht.com/ytc/AKedOLQQ8OehAtjUcXgw85xH-QkvbR742gBssNv3CHS0=s48-c-k-c0x00ffffff-no-rj
UgyYhoe1IvZRQtGuELZ4AaABAg,0,vN30emwcNS4,"You will and have saved many lives. Thank you Dr Sehuelt. I think you helped save my husband’s life after exposure to Covid. W your protocol, just a mild “cold “ sx. I got a more severe flu, and anginax2 episodes which I had never had before in my life. But I have metabolic syndrome prefiabetes/diabetes more than he has. Fixing that now w nutrition, functional med ( biochemistry based medicine), intermittent fasting to lose weight : working quite well. Over 10 weeks, lost 15 lbs, sleep apnea improving, depression getting better, brain fog lifting, etc. Thank you as we have applied your principles to family, etc. You really are a Godsend",2021-02-02T16:50:30Z,Doris Mendiola,https://yt3.ggpht.com/ytc/AKedOLTZFGjezWDSXBW3kQv8RwaKL6xuHBXIx97BsQ=s48-c-k-c0x00ffffff-no-rj
Ugzi-71JIQyKpe6WCdN4AaABAg,0,vN30emwcNS4,"Great advice, good job.",2021-02-02T14:00:47Z,Michael Martin,https://yt3.ggpht.com/ytc/AKedOLQgCB0UhM75_1sYlff4qFPrcYcMmYsGDDXoDQ=s48-c-k-c0x00ffffff-no-rj
UgyulXkXcrFbcPLwVX94AaABAg,0,vN30emwcNS4,Ivermectin,2021-02-01T22:09:33Z,JANGO129,https://yt3.ggpht.com/ytc/AKedOLQ3cqoB90lYeJHKj0iMRl-b9-6LXk_ElomqJlJG=s48-c-k-c0x00ffffff-no-rj
Ugz_eXi9_TRPPjQ7xJl4AaABAg,0,vN30emwcNS4,What about ivermectin ?,2021-02-01T19:53:37Z,Judith Game,https://yt3.ggpht.com/ytc/AKedOLTStWIRBfu0-_e1F_ej4oVEW7nAdj7eGFxrqA=s48-c-k-c0x00ffffff-no-rj
UgwhxMNzIyg2L2Mvm2l4AaABAg,0,vN30emwcNS4,Very good video. Very useful and informative,2021-02-01T19:29:45Z,R M,https://yt3.ggpht.com/ytc/AKedOLT02Ot6FelpJ6B6kynzV8GPXRI9PaIr5j1PFg=s48-c-k-c0x00ffffff-no-rj
UgySthfLovFcMu_glc94AaABAg,0,vN30emwcNS4,"I can't even get away from the sun here in southern California down the road from Riverside...

All's I need to do now is to get to bed at 8:00 p.m. lol",2021-02-01T16:11:35Z,Ansu John,https://yt3.ggpht.com/ytc/AKedOLTBNsVyQbsuEUmN8wGX1ngy9lwq-8iY9ThtElKhIw=s48-c-k-c0x00ffffff-no-rj
Ugxir4ss4MLlgwywQtt4AaABAg,0,vN30emwcNS4,"Best video I’ve seen on this subject!! Very comprehensive with scientific data to validate! 
Thank you!!",2021-02-01T02:08:31Z,Tracy Gillen,https://yt3.ggpht.com/ytc/AKedOLQL1PZqQt5nJhTVLqoQEfTSAac3Vd6mr7-jJg=s48-c-k-c0x00ffffff-no-rj
UgxKchIdCyrH1SgkA7d4AaABAg,0,vN30emwcNS4,"At home with mild illness and so glad I took this advice! I think I gave myself the best chance. Good luck to other essential workers, you are doing your best.",2021-02-01T01:26:16Z,Metta Analysis,https://yt3.ggpht.com/ytc/AKedOLQkX_sTEH99UXmKzVYntvpOPvPFrbTEBUtisQ=s48-c-k-c0x00ffffff-no-rj
UgyFvdoyDSMamiVB_od4AaABAg,0,vN30emwcNS4,Thank you for your information about Covid19,2021-02-01T00:42:02Z,G. BIYIKLI,https://yt3.ggpht.com/ytc/AKedOLQgSjuTpYEFzUhZ0oW3SQx4bprG7uR2etwqfA=s48-c-k-c0x00ffffff-no-rj
Ugw-s3i77S8krY44aQJ4AaABAg,0,vN30emwcNS4,"Thank you!! I live in Nebraska and I had my Vit D checked by my NP this summer. It was 28.3 ng/mL and I decided to supplement with Vit D. I also got a pneumonia shot and later a flu shot. My BMI is around 33. Well, I got COVID about the same time as former Pres Trump and I read what his doctors gave him. So, I continued to take Vit D and added Zn, a baby aspirin, and melatonin, and purchased an oximeter. I did not use any fever-reducing medication and let my body sweat plus I took lots of really hot baths. My oxygen dropped to 90-91% and my heart raced. Now, my BP is up 156/92 and I have a little bit of lung scarring and an abnormal EKG. After watching your video, I am planning to visit my NP and add Mg, I also have dropped 15 pounds so my BMI should improve. I am a white, 66-year-old female. Your video gave me GREAT reassurance that some of my pre and post-COVID steps probably helped me. (HA! I gotta work on lowering my BMI and hopefully my BP will follow) Thanks again for making these videos. i can really understand what you are trying to get across to us! ""COVID for DUMMIES""",2021-01-31T23:37:57Z,Teresa Hayes,https://yt3.ggpht.com/ytc/AKedOLQSaCj_KmUVxv2p4Js8CxRPd7cI0VjB1M3lDu0xJg=s48-c-k-c0x00ffffff-no-rj
Ugxs1l9REucMne7gvJd4AaABAg,0,vN30emwcNS4,Med cram you're the best!!,2021-01-31T15:14:27Z,Jim Jones,https://yt3.ggpht.com/ytc/AKedOLRCs8C0a-rGxHRvvTO9_YW920cs4f14vcYCvA=s48-c-k-c0x00ffffff-no-rj
