commentId,parentId,videoId,textDisplay,publishedAt,authorDisplayName,authorProfileImageUrl
UgwHbFs1Sj-1dpm43iF4AaABAg,0,vN30emwcNS4,Thanks for another awesome and informative lecture. I Love the medcram videos! I'm a respiratory therapist. I take most of the mentioned supplements. I have remained healthy throughout the pandemic. I truly believe the supplements are helping. God bless Dr. Seheult and his sharing of valuable information!❤❤❤,2021-01-04T23:46:45Z,Becky Barnett,https://yt3.ggpht.com/ytc/AKedOLSHrdB5uwBg7zOMulZy7pBGLTIIIzVkLtfZqg=s48-c-k-c0x00ffffff-no-rj
UgyuSbhNcmmRQPN2wfR4AaABAg,0,vN30emwcNS4,I am SO impressed by and grateful for this video. There’s no greater antidote to fear than reliable information and a plan of action.,2021-01-04T23:36:12Z,Susan Freeman,https://yt3.ggpht.com/ytc/AKedOLSMyrqzwZ4QfXvq06IQMuKxZUCd_VX2msjEYkJyiQ=s48-c-k-c0x00ffffff-no-rj
UgwjZxoHZviKa8azXjx4AaABAg,0,vN30emwcNS4,You are my favorite professor at UCR SOM. Thank you again for your informative videos!,2021-01-04T23:31:40Z,general9872009,https://yt3.ggpht.com/ytc/AKedOLT5_ERAYKS-QFM0ANqd_m0QcoULKBxfHakIkw=s48-c-k-c0x00ffffff-no-rj
UgwSlVZzId3e9sVvYyN4AaABAg,0,vN30emwcNS4,However isn’t it that body has the capability to heal itself and attack foreign bodies as long as you are providing your body with good nutrition?,2021-01-04T23:29:06Z,prescilla olangcay,https://yt3.ggpht.com/ytc/AKedOLSm9P7xoIdl25mD7vUL0Fnb9adGUDRM49YwaQ=s48-c-k-c0x00ffffff-no-rj
UgyZDBlnsKHWVjteZQN4AaABAg,0,vN30emwcNS4,"I have been watching you since April. Thank you for being such an awesome human being.

One request (maybe you'll see this):
Can you please do a shorter, 5 minute video for the average layperson?

I would love to share this video on social media, but I fear it will be over a lot of heads.",2021-01-04T23:20:01Z,Amy Reynolds,https://yt3.ggpht.com/ytc/AKedOLQ3kdH3a1Ads1tKu-qnSYjkHdWl86GgzGzjpQ=s48-c-k-c0x00ffffff-no-rj
Ugz92EdrXswElyKs3Px4AaABAg,0,vN30emwcNS4,Check Rhonda Patrick on sauna benefits,2021-01-04T23:07:40Z,Sid Michael,https://yt3.ggpht.com/ytc/AKedOLSswkdloll1CnKFIqzKjO2U-tsOiFpSL1pAB56DRQ=s48-c-k-c0x00ffffff-no-rj
UgzicYRKqfX7PtyzlIR4AaABAg,0,vN30emwcNS4,Thank you doctors!  I went to Loma Linda Medical School!,2021-01-04T23:05:38Z,mcc2442,https://yt3.ggpht.com/ytc/AKedOLRxHuC8PF6sY-xQ1-Kpm4vAOoA3uSg6ZaEA5_7slw=s48-c-k-c0x00ffffff-no-rj
UgwVhiCmIg4d0AJRwnB4AaABAg,0,vN30emwcNS4,"THANK YOU for mentioning vitamin K2 (amd magnesium!) ! bad idea  to calcify arteriea due to vit d imbalanced with k2. I havent heard an MD say to take K2 with D3 on youtube yet. I am relieved and heartened. - an RD

also red cabbage is an excellent source of both quercetin and cysteine.

id be interested to see if reduced glutathione does better than NAC.",2021-01-04T22:52:00Z,havvasweb,https://yt3.ggpht.com/ytc/AKedOLSFJog6Gg8IuoPh7L-A1S-vK0pvbAmizFEx0Q=s48-c-k-c0x00ffffff-no-rj
UgzklFd4qLgn-NX8hyZ4AaABAg,0,vN30emwcNS4,Great and Helpful information! Thank you.,2021-01-04T22:02:25Z,Lynne Crosby,https://yt3.ggpht.com/ytc/AKedOLSFBNHtO40KEflJbgj7zRL05NiWCBIO7Dwh8UggWg=s48-c-k-c0x00ffffff-no-rj
UgwgJ0cliJNYa_1ZBNJ4AaABAg,0,vN30emwcNS4,Can you recommend a brand of quercetin and nac?,2021-01-04T21:47:43Z,Donna Bush,https://yt3.ggpht.com/ytc/AKedOLShn59IYUZrnUkmgP0r4zTD55JchWOyHYci6g=s48-c-k-c0x00ffffff-no-rj
UgxmDTDF2CjR3-O4GNp4AaABAg,0,vN30emwcNS4,This is very informative that everyone knows!,2021-01-04T21:42:22Z,Avery Amber,https://yt3.ggpht.com/ytc/AKedOLTVHr4O6vFVPqRtHlz6yAat_xCBdR8u_E8U4g=s48-c-k-c0x00ffffff-no-rj
UgzIM3qR4CUum-hbNOZ4AaABAg,0,vN30emwcNS4,"what is the down-side of supplementing with NAC year-round? And, why only use it seasonally or during periods of higher risk of viral infection? We are at risk of oxidative stress damage year round. There are many reasons for GSH depletion outside of viral infection. oxidative stress may be the root of all disease! Lastly, if you are of poor general health, shouldn't you be more inclined to boost your endogenous anti-oxidants?",2021-01-04T21:41:12Z,MrLeewsee,https://yt3.ggpht.com/ytc/AKedOLQxs9dtaBwHHMUFgPY5bsnkfxwsnRYrwcspKA=s48-c-k-c0x00ffffff-no-rj
UgwF1qiXLbBgMjtjuD54AaABAg,0,vN30emwcNS4,I love how the questions range from very basic street questions to questions that med professionals may have and the answers also are simple enough yet complex enough for a range of audience.,2021-01-04T21:36:48Z,iceangel587,https://yt3.ggpht.com/ytc/AKedOLRc-hqMj5iCK1dx-qPtdQx4s-Nc9ZAvyy_wquOH=s48-c-k-c0x00ffffff-no-rj
Ugx4DGSNPG0vuuS_EOd4AaABAg,0,vN30emwcNS4,I got it and so did my husband no hospital stay only one emergency visit because of. My fever no stop and no stop headaches.,2021-01-04T21:24:22Z,Gloria Terry,https://yt3.ggpht.com/ytc/AKedOLTE5oKJN6SulALPxTWVFXP3mTjhz1l5V66IR9_X1Q=s48-c-k-c0x00ffffff-no-rj
Ugx90CMt0MIZqmXD7j54AaABAg,0,vN30emwcNS4,"I agree as a retired nurse this is the only place I have found sense being made, and real and reliable advice given ♥️",2021-01-04T21:16:10Z,Dekanogi Ulogilv Staples,https://yt3.ggpht.com/ytc/AKedOLR15B2mBEJmBsAmmzzQ0XRnqotoPd11s4b3_yEydQ=s48-c-k-c0x00ffffff-no-rj
UgzKkh5a1ZUWnfTxZMp4AaABAg,0,vN30emwcNS4,"Yup! We do hot and cold showers, sauna, hot water baths, massage with warm oil and essential oils. We love lots of natural healthy immune building treatments. We try to make this our lifestyle. 
We can wear mask, sanitizer and keep things clean. If they have traveled, wear mask, opened the Doors for ventilation. 
Thanks for all these wonderful natural things at home. Like the cracking windows of the peoples room, and opening other doors . 
We did lots of these things. We didn’t use a pulse Ox! I need more SLEEP!",2021-01-04T21:04:38Z,Rev. Pamela Hart,https://yt3.ggpht.com/ytc/AKedOLRVZMKvp9TDfxetRbuEwXvf7bUlccltXvl-GOmFeA=s48-c-k-c0x00ffffff-no-rj
Ugwy-i7tXSupCN-blMB4AaABAg,0,vN30emwcNS4,"That’s right about not treating the fever above 101 is what my family and friends did. Let them know that the body is fighting for you so get protein and broth and water. Take the nutrients, we did do Hot baths and massage with warm oil and essential oils like lavender and peppermint oil and warm olive oil. 😃🥰❤️🙏🏾🙏🏾🙋🏾‍♀️",2021-01-04T20:58:48Z,Rev. Pamela Hart,https://yt3.ggpht.com/ytc/AKedOLRVZMKvp9TDfxetRbuEwXvf7bUlccltXvl-GOmFeA=s48-c-k-c0x00ffffff-no-rj
UgxvQec3WdaiPgdlp4x4AaABAg,0,vN30emwcNS4,"My family and a few other families have been doing 10,000 IU-Vitamin D3 to 20,000 IU, all the people that we know who were positive COVID-19 had recovery and short lived symptoms. Ages varied from 24 years to 65 years old. Everybody is definitely happy they used Vitamin D3 and Vitamin C and The Herb Echinacea was what everyone did in common. This is approx about 30 black people I know who did this. I love MELATONIN... addition.
Zinc for me made my stomach hurt -30 mg but I took on empty stomach. Most all my nutrients my body does well on empty stomach.
So I just didn’t do Zinc. I do my nutritional program since March personally.

So glad the people I know are keeping up with a nutrition supplemental use of vitamin D3. 
The innate immune system was a big learning for me. I like this interferon information.",2021-01-04T20:50:38Z,Rev. Pamela Hart,https://yt3.ggpht.com/ytc/AKedOLRVZMKvp9TDfxetRbuEwXvf7bUlccltXvl-GOmFeA=s48-c-k-c0x00ffffff-no-rj
UgzF1WiWLzEChUuAKG14AaABAg,0,vN30emwcNS4,"What about ceiling fans? I love sleeping with the window open a bit in the winter and also a fan. Is the fan hurtful or helpful, or doesnt make a difference? Does it spread it around?",2021-01-04T20:41:53Z,Tamara Bradberry,https://yt3.ggpht.com/ytc/AKedOLRDa8TwPFkUaYD0ENl-mbTZAdMULV_JecZ7HQ=s48-c-k-c0x00ffffff-no-rj
Ugw6V8JQqld6CFT4gfN4AaABAg,0,vN30emwcNS4,What about Ivermectin? Is there any new data that shows it could be beneficial for covid 19?,2021-01-04T20:38:46Z,Michael Olson,https://yt3.ggpht.com/ytc/AKedOLTA76wVKkwONRkypv2oSBp0NWn7xrrNUT2KcA=s48-c-k-c0x00ffffff-no-rj
UgySbO9bxPwsMdTK-c54AaABAg,0,vN30emwcNS4,Ive never heard of C. and D. Can one get those over the counter? Easy to find?,2021-01-04T20:22:19Z,Tamara Bradberry,https://yt3.ggpht.com/ytc/AKedOLRDa8TwPFkUaYD0ENl-mbTZAdMULV_JecZ7HQ=s48-c-k-c0x00ffffff-no-rj
Ugz3y_Y4RKSrxo-TK_p4AaABAg,0,vN30emwcNS4,How about high dose vitamin C ?,2021-01-04T20:21:45Z,skyhawkfl MacMillan,https://yt3.ggpht.com/ytc/AKedOLQzXr6vaVsxgekd-rc1_ws7p-X78oMW5Hu20A=s48-c-k-c0x00ffffff-no-rj
UgyGcKggU3FPaJWEJPB4AaABAg,0,vN30emwcNS4,"Excellent video and graphs with 1st class research to back the science. 
Please will this protocol be the same for  someone who s got COVID and 2 months pregnant?",2021-01-04T19:54:32Z,David Morrison,https://yt3.ggpht.com/ytc/AKedOLQklEWL0gGURksfi1-ZDlPX23OvFRxenvRsIw=s48-c-k-c0x00ffffff-no-rj
UgwPfPmpeAWRWMRGAyJ4AaABAg,0,vN30emwcNS4,Doc what about selenium?,2021-01-04T19:46:42Z,Zebibe Yirga,https://yt3.ggpht.com/ytc/AKedOLTxsJ7qlRELXlgmvklikoxwhZ4Ptyz7zJU80g=s48-c-k-c0x00ffffff-no-rj
UgyKmLUHiPIA92KKNyx4AaABAg,0,vN30emwcNS4,Been watching MedCram for years. So dependable! Glad more people are finding the channel during this time,2021-01-04T19:38:22Z,Veronica Mcminn,https://yt3.ggpht.com/ytc/AKedOLRM8nWgH3z2PfGjBLfzo4g1yBpkqGFGi2lxgg=s48-c-k-c0x00ffffff-no-rj
UgwPj5up6AgM6R1KKhV4AaABAg,0,vN30emwcNS4,Everything discussed here is absolutely true! My 79 old mom survived doing all these things.,2021-01-04T19:35:26Z,Yanett Gardner,https://yt3.ggpht.com/ytc/AKedOLT6-inOYCHXzTuybPSxTUW8H15NKJLyDWmjHtk7ZJs=s48-c-k-c0x00ffffff-no-rj
Ugw11xUmn4ymZVaKaM94AaABAg,0,vN30emwcNS4,"I greatly enjoy watching these videos from Dr.Seuhelt. A great teacher is able to present the complex in a simplified way. An older fellow engineer many years ago told me he would always take hot baths when he got sick, I've been doing this now for years. Wanted to post this link about steam inhalation as well...
https://www.google.com/amp/s/www.news-medical.net/amp/news/20201130/Steam-inhalation-therapy-found-to-inactivate-SARS-CoV-2-virions.aspx",2021-01-04T19:14:27Z,Martin Gilliam,https://yt3.ggpht.com/ytc/AKedOLQtHGNVkfzslw66f97ZdquEeCetzgkpdYdKGw=s48-c-k-c0x00ffffff-no-rj
UgyzxKNX6KxdC_YbJNF4AaABAg,0,vN30emwcNS4,"In addition to monitoring SpO2 with instrumentation,  what about monitoring temperature?  What what are guidelines for when to head for the ER based on temperature?",2021-01-04T19:01:58Z,Earl Jacksboro,https://yt3.ggpht.com/ytc/AKedOLTRGgrrbunR8I66xVBce_xYJtpLsq41TP2CvQ=s48-c-k-c0x00ffffff-no-rj
UgxKfOxlh5ugalfJ9sp4AaABAg,0,vN30emwcNS4,"I just lost my 85 year old father to complications from Covid-19. We live in Riverside County, in a place called Anza, which is 4,000 ft above sea level.

December 8, 2020, my father and I got hit with the Covid-19 virus, then on December 14, 2020, symptoms manifested, and Dad was rushed to Temecula Valley Hospital because he had issues breathing.  The paramedics measured his oxygen at 92%, using that tool, that you talked about. 

Anyhow, after two weeks, my father didn't make it. He was able to fight off the virus, but the initial infection started some kind of chain reaction. My Dad's kidneys started to fail, they were operating at 13%, soon the Doctors at TMV, informed us that he may not make it. Truth was... his body began the 'active dying' process. Dad was my best friend, he was father, and I'll miss him. 

The hardest part, and deepest pain, is not being able to say goodbye. 

I'm now Covid-19 positive, and my self-imposed quarantine is still ongoing. I've got a five acre ranch with livestock, sheep and goats. Everyday, I'm in the sun, continuing the work of my family. Wish me luck.",2021-01-04T18:40:32Z,Ben Cruz,https://yt3.ggpht.com/ytc/AKedOLQ8jNCtVb84lKeDsCUTlS42Ja4voM__vyJrJcvi=s48-c-k-c0x00ffffff-no-rj
UgwW4132VLwKED9xv9h4AaABAg,0,vN30emwcNS4,If I’ve been sick over a week is the antibody treatments too late.,2021-01-04T18:28:31Z,Ashley Ruma,https://yt3.ggpht.com/mEYqsGgSMNO_Go4stCJzNCcCNsrxxx4EtF8cywVCFFKNnKOW9G2e2Akp97nwZBCEAj5Fj7byfg=s48-c-k-c0x00ffffff-no-rj
Ugz5Avgawm8fUCjPoo54AaABAg,0,vN30emwcNS4,Everyone in the world should see this video.,2021-01-04T18:09:05Z,HunterInstruments,https://yt3.ggpht.com/ytc/AKedOLRqOHGcfcJjjs8zstZDexL4gw370-aMyE3PQIKI=s48-c-k-c0x00ffffff-no-rj
UgyIsnDwqi7F53qUBk94AaABAg,0,vN30emwcNS4,Thanks.  Great overview as usual.  I'm curious what your thoughts are on Ivermectin and I-MASK+ which has been championed by https://covid19criticalcare.com/ ?,2021-01-04T17:56:30Z,m&m,https://yt3.ggpht.com/ytc/AKedOLTVtu4ZfdhF9-0fRSYy0cTeZ0X8sUQ9NWtrbg=s48-c-k-c0x00ffffff-no-rj
UgznEyKVbugagKq03Md4AaABAg,0,vN30emwcNS4,"I don’t know if this was addressed, if you have first vaccine dose, get COVID before second shot, could you still receive next dose at 21 days? What is the schedule for second dose if you get COVID between first and second dose?",2021-01-04T17:50:08Z,gtulino,https://yt3.ggpht.com/ytc/AKedOLQZBw__r83JM7tA45M-zgiyzKUfKdnpWVCW=s48-c-k-c0x00ffffff-no-rj
UgzIqK8T5mO9jxnxDw54AaABAg,0,vN30emwcNS4,"Could you please do another video in this series?  Part 1 was prevention, Part 2 was what to do if you test positive. Part 3 should be if you do end up in the hospital, what should the hospital do?  Can you believe that there are doctors, hospital administrators, and politicians who do not watch Dr. Seheult's Covid videos, and who therefore might not be giving patients the best treatment?  We see lots of stats about cases and deaths, but we do not see stats about what the survival rate is for those who enter ICU and how it has changed with time and how it varies between states and hospitals.",2021-01-04T17:41:00Z,Salieri,https://yt3.ggpht.com/ytc/AKedOLShaP37VjekWNqRfCmi6pSby8A3o4ELs3wDvw=s48-c-k-c0x00ffffff-no-rj
UgySjaEQ8R2BmUm5mYR4AaABAg,0,vN30emwcNS4,"In August 2020. My husband had covid. He was 65, obese and getting very weak. I took him to the ER. They said o2 sat was 95 and they only listened to his lungs and said he didn’t have pneumonia and there was nothing they can do for covid and go home. His sat dropped as low as 83-86. We’re lucky he survived on his own.",2021-01-04T17:31:02Z,Susan H,https://yt3.ggpht.com/ytc/AKedOLSNDuu2jVuMWL6ViN8gXvnC8tZcoMWzD0huUVVm=s48-c-k-c0x00ffffff-no-rj
UgyWgeiG0smwVv_Omcl4AaABAg,0,vN30emwcNS4,I've been taking 4-6000 IU most days for months. Level was 62. In Chicago.,2021-01-04T17:22:37Z,darkktur,https://yt3.ggpht.com/ytc/AKedOLRn_Y7css-lGWgHdwHMP4K4MZqjUUdE7eeWsA20mQs=s48-c-k-c0x00ffffff-no-rj
UgxGJpxfAGSWAehBdA54AaABAg,0,vN30emwcNS4,Medcram has been my lifeline. Thank you for your comprehensive and useful updates.,2021-01-04T17:13:58Z,Johanna Quinones,https://yt3.ggpht.com/ytc/AKedOLQY-MAMSUvyzj3pOS5VvfALiitFIW0qNd0wVQ=s48-c-k-c0x00ffffff-no-rj
Ugw3yJ6Z2H8biiL4Fl94AaABAg,0,vN30emwcNS4,"Finland has traditions of a spell of some minutes in a hot dry sauna, followed by a dive into a cold lake.    That would seem to mesh with the thermo-therapeutic activaction of the innate immune system described by the Doctor Seheult.",2021-01-04T17:10:04Z,Bob Van Wagner,https://yt3.ggpht.com/ytc/AKedOLR5VyA8Hp_yibCdWDh39wV5wAxDZhgHZ0OY_ZQT=s48-c-k-c0x00ffffff-no-rj
UgxgjuEdqJAvIjeg1bx4AaABAg,0,vN30emwcNS4,Would putting face coverings over our mouth and nose reduce our O2 levels? Is it true that the Covid 19 virus is not blocked by most face coverings and masks because it is so small?,2021-01-04T17:07:17Z,Robert Mearns,https://yt3.ggpht.com/ytc/AKedOLRKM1WOQVCye_2n77SlqF9AOcKbQPFNL1WvQMVq=s48-c-k-c0x00ffffff-no-rj
Ugzz_GgbQGRUGVq5hWN4AaABAg,0,vN30emwcNS4,"Forgive me if this question has been answered before but I have a rare numerological auto immune disease called Anti Mog, my B cells overreact and attack the Myelin oligodendrocyte glycoprotein (mog) of the cns resulting in optic neuritis and/or transverse myelitis. Rituximab is used to treat this disease and I’ve had bad reactions to it and the steroids they give me for said reactions. So much so my neurologist decided I skip infusions last year because it cause my type 2 diabetes to go sky high and he said that risk alone was too dangerous w covid19 around.....would that be the same for the infusions suggested in this video? My immune system is almost back to normal now but my immunoglobulins are low from the past rituximab infusions. Would that be an option that viable for me or am I essentially screwed? I’m in several of the high risk categories. Asthma as well. I know rituximab is also a monoclonal treatment.",2021-01-04T17:03:26Z,Laura Angela Arredondo,https://yt3.ggpht.com/ytc/AKedOLRgQvBeT597ystH1XsTOy0_vLLwYVjCj-aoSwzl4OU=s48-c-k-c0x00ffffff-no-rj
Ugz7NsHFgocp_Yqeae54AaABAg,0,vN30emwcNS4,Very informative & useful.. Thank you Prof. Seheult.,2021-01-04T16:57:00Z,matta srinivas Mohan,https://yt3.ggpht.com/ytc/AKedOLSYQZvKiNJ23dI-HHf3T2pO4oDwE04jJ37DhGLVuA=s48-c-k-c0x00ffffff-no-rj
UgxUrEQNmKZJGPgQ7mJ4AaABAg,0,vN30emwcNS4,Thank You. Stay well.,2021-01-04T15:44:55Z,susan mitchell,https://yt3.ggpht.com/ytc/AKedOLRtBZo54NNn0rJB17EV5AfeTKS2uW6JCrNdgQFLqw=s48-c-k-c0x00ffffff-no-rj
UgwtuCFgW_ise4lOow14AaABAg,0,vN30emwcNS4,"Very interesting. Thank you.
What about Coenzyme Q10. Would IT be beneficial?",2021-01-04T15:16:32Z,Guy Bergevin,https://yt3.ggpht.com/ytc/AKedOLRu6y0NASK-KwJiw5YMPopJPBpxTtmGqHnP5VrgSMc=s48-c-k-c0x00ffffff-no-rj
UgyL8dQvgt6oupwvFkd4AaABAg,0,vN30emwcNS4,Interesting observations gentlemen.,2021-01-04T15:11:30Z,Anitra Moore,https://yt3.ggpht.com/ytc/AKedOLTm6mUayIbvY-TuOA4P6kL-G4iUnJWnm0fePg=s48-c-k-c0x00ffffff-no-rj
Ugxj6AEyWmXovH-pNUt4AaABAg,0,vN30emwcNS4,Thank you for this very informative discussion.,2021-01-04T15:11:30Z,Bless The US 2020,https://yt3.ggpht.com/ytc/AKedOLQpmJONbj0MZosPJY8FJ59AyvMDt6tpq4exGw=s48-c-k-c0x00ffffff-no-rj
UgwBg37kZ_2Jf2mdiVp4AaABAg,0,vN30emwcNS4,Any research on autoimmune disease and how well people do with those comprised systems?  I have Graves’ disease and in remission. Still have my thyroid and was treated with meds for a few years.  Just curious if autoimmune issues makes you less or more vulnerable.,2021-01-04T14:59:35Z,Anitra Moore,https://yt3.ggpht.com/ytc/AKedOLTm6mUayIbvY-TuOA4P6kL-G4iUnJWnm0fePg=s48-c-k-c0x00ffffff-no-rj
Ugy3PUq5mv_A99jOHfd4AaABAg,0,vN30emwcNS4,Why isn't this information presented on the nightly news? Instead we are all told to be scared and take your shot. 💉,2021-01-04T14:53:58Z,D Pro,https://yt3.ggpht.com/ytc/AKedOLR2ePXH23i82urfW1-SjKWjULM92X22reQUbhcSvQ=s48-c-k-c0x00ffffff-no-rj
UgwP6IrBo4hLuTPpH8F4AaABAg,0,vN30emwcNS4,Is an interferon supplement administered by MDs useful as an early treatment of Covid-19 ?,2021-01-04T14:52:41Z,George in Japan,https://yt3.ggpht.com/BRRA7QjY2yKHaBV-JewXRyIcZC-fEsFkYZK6Xr6-KMKD1hO-bcFiSzxHXBXSzUQvjm87ktZGi0Y=s48-c-k-c0x00ffffff-no-rj
UgyIwEprjisxtGBO0Px4AaABAg,0,vN30emwcNS4,"This channel and especially THIS DR., is awesome and just a fantastic service to us all!",2021-01-04T14:41:25Z,fvck twitter,https://yt3.ggpht.com/ytc/AKedOLRbtnaLen1xAUe2YLyjRtRSxuF3lcoEifk6Ow=s48-c-k-c0x00ffffff-no-rj
Ugx8q9faFOFAmGXDa2N4AaABAg,0,vN30emwcNS4,brilliant video thanks for this great resource,2021-01-04T14:36:56Z,InTheChilledAisle,https://yt3.ggpht.com/ytc/AKedOLRaec_1RY_Z_Tpg2g-AdrEFqLORQ8mQkY1mGXpF=s48-c-k-c0x00ffffff-no-rj
UgxIZmmedX2MGxSRqwt4AaABAg,0,vN30emwcNS4,I have had a pulse ox and it’s great to have on hand! Glad they are available now.,2021-01-04T14:12:12Z,Anitra Moore,https://yt3.ggpht.com/ytc/AKedOLTm6mUayIbvY-TuOA4P6kL-G4iUnJWnm0fePg=s48-c-k-c0x00ffffff-no-rj
UgwzuFUFBFjIw5u6n1R4AaABAg,0,vN30emwcNS4,"My wife got covid while I was on a hunting adventure. I came home to take care of her. I was with her for a week and never got covid symptoms.
I can contribute this to a few causes. My  exposure to sub freezing temperatures while on stand, and taking quercetin, zinc, vit-c, melatonin, nac. My wife was also on quercetin and zinc prior to infection. She was treated with hcq and a antibiotic from her primary care physician ( functional medicine doctor). 
She was fully recovered in a week and we were biking within a week enjoying the rest  of her mandatory time off together doing fun stuff.",2021-01-04T13:00:54Z,365OutDoors,https://yt3.ggpht.com/eh-24E1KiB2h4eBDTj-_U8wcjeAm1nEeDfQgkkSBpGoyxtx3sEbyzjc4J00GkCd0EOOIhLMIkw=s48-c-k-c0x00ffffff-no-rj
UgwKlN_BryyUxdFfoHp4AaABAg,0,vN30emwcNS4,"Thank goodness I am already taking zinc 50mg, Vitamin D3 (5000) with K2.  Appreciate your input and posting of this video.",2021-01-04T12:56:39Z,Ann S. Chong,https://yt3.ggpht.com/ytc/AKedOLRaPGIvs49yu6DT5uZcUzDiTKmKsL2KBKaH3887AA=s48-c-k-c0x00ffffff-no-rj
UgyhbxARmnTp8BdqwaB4AaABAg,0,vN30emwcNS4,Thank you for sharing your wisdom!,2021-01-04T12:54:10Z,rlp230,https://yt3.ggpht.com/ytc/AKedOLT156oIyvrfLVzpswg5BcpVoJq_YdE6guo_6_L9=s48-c-k-c0x00ffffff-no-rj
Ugz_KVkDed9iIaeSBUd4AaABAg,0,vN30emwcNS4,Thank you!!,2021-01-04T12:23:02Z,Sander,https://yt3.ggpht.com/ytc/AKedOLShLcfnePp1AcQN-ZLcOXZDM8DawKhvLJcNihsc=s48-c-k-c0x00ffffff-no-rj
UgzWUom8fWl4UoAqMfx4AaABAg,0,vN30emwcNS4,"Thanks for the wrap of on mono-ab
Where i practice there is no access to this brand new option...they say it should be prescribed early in the course...when exactly is this ""early""?? as patients present at different points during their course...and as its well confirmed, many clear virus as part of their natural history anyway...the optimal time being unknown, from my point of view, may cz underestimation of its effectiveness...i wonder if there is any study targeting this caveat...and i also wonder if monoab is protective the hyperimm plasma can also be an option in areas wo access to monoab...it would be grear if you would cover the evidence so far and studies that are underway
I look forward to getting it digested through medcram team exocrine apparatus:)))!!!",2021-01-04T12:01:21Z,Fast Mohawk,https://yt3.ggpht.com/ytc/AKedOLQtSol0YrgpRsC4OVOnWoauCQKfJduRWAfwew=s48-c-k-c0x00ffffff-no-rj
UgyStsn7mGJDXCA7Mo14AaABAg,0,vN30emwcNS4,"About 6 months ago, vitamin K deficiency was being discussed in connection with difficult cases of Covid-19. And the Danish media have finally picked up on it (even though they are quite sceptical about vitamin D and vitamin C).  I hope Dr. Seheult will take this up.",2021-01-04T11:36:09Z,Dina Grossman Kjærgaard,https://yt3.ggpht.com/ytc/AKedOLQyjRMkIqMlZ5jWkj-dNyozkuTK6_dRZZKbdA=s48-c-k-c0x00ffffff-no-rj
Ugw0EWJIbF7ZYKFRicR4AaABAg,0,vN30emwcNS4,"Dr. Seheult and Kyle Allred, thank you! for everything you do. I was diagnosed with chronic lymphocytic leukemia in December 2019, a few months before the pandemic started here in the U.S. You have given me reason to hope and invaluable guidance and evidence-based information that has kept me from total despair over the last year. Thank you again! and please stay safe and we’ll.",2021-01-04T11:24:49Z,Kathy Shank,https://yt3.ggpht.com/ytc/AKedOLTQAzmNm2-P4b3FGyBDkquW_soTuUV-yA52zk9q=s48-c-k-c0x00ffffff-no-rj
UgzsXo8OD7poQfgoT_x4AaABAg,0,vN30emwcNS4,Thank you.for all the information.,2021-01-04T09:51:03Z,MohawkAKtownWarrior,https://yt3.ggpht.com/Vd0Cgg4kKCt7PCHXpB_sxCOLV2lXdHMBnLTRTU9y8Q2FARbDB2bJ510KPl0ecBIceLujiDOR0g=s48-c-k-c0x00ffffff-no-rj
UgwesHurIYh_UXlxOel4AaABAg,0,vN30emwcNS4,Phenomenal.,2021-01-04T09:50:52Z,Leslie Ross,https://yt3.ggpht.com/ytc/AKedOLQVIOwzlF3_t7GPa_MTcek1ytoc-bMqg8caAf_kNg=s48-c-k-c0x00ffffff-no-rj
UgzDjyBCypA77qG4B_R4AaABAg,0,vN30emwcNS4,What happened to corticosteroids and listerine?,2021-01-04T09:49:11Z,Lying Eyes,https://yt3.ggpht.com/ytc/AKedOLQ3IPqksT8qgJvo2O04hzmjo3yD2RfKomJCLYFr=s48-c-k-c0x00ffffff-no-rj
UgyTE7i_eW6pFEXLNdV4AaABAg,0,vN30emwcNS4,I’ve done “fever treatments” for fibro as recommended by doctors who specialize in this. You are supposed to keep your head cool and there is a particular temperature and a specific time you need to keep your body at that temp. It’s hard to do by yourself but it is possible. I’d be interested in being part of a study. I am 64 and have not had COVID19 yet as far as I know.,2021-01-04T09:40:25Z,Christiane Marshall,https://yt3.ggpht.com/ytc/AKedOLQw8lrVwwNQAZr8mun3V3NSK5RmAby4rUE7tZE-AQ=s48-c-k-c0x00ffffff-no-rj
UgyCKqUbn-1CkPb4W4J4AaABAg,0,vN30emwcNS4,"Thanks, Great Commentary!",2021-01-04T09:39:41Z,MatildaAnn Chisley,https://yt3.ggpht.com/ytc/AKedOLQ1xVVibnshs1weS4jbg4ExbJqLS3lHV3XIEniH=s48-c-k-c0x00ffffff-no-rj
Ugwehkjwg1tO4kEBuwl4AaABAg,0,vN30emwcNS4,"Dr. Seheult,
What about Ivermectin?
That's the big question.
Is dr Kory and the FLCCC wrong?
I value your opinion.",2021-01-04T09:25:55Z,garykap,https://yt3.ggpht.com/ytc/AKedOLR0WcGS9wOhOb-PBOdqH7B70gf4TMbgoGhm0w=s48-c-k-c0x00ffffff-no-rj
UgwO5OPJ0eeL_KLRPdt4AaABAg,0,vN30emwcNS4,Do you have any opinions about using Ivermectin?,2021-01-04T08:26:38Z,WiP FiS IiS 84,https://yt3.ggpht.com/RZicCNVaBbtP77bSLR6yuyKAdbykGvx66itObKmS_0iYh3X9ELg-Cfdr5a-PLGt_ztHYxVri=s48-c-k-c0x00ffffff-no-rj
UgwSW_S3zNVc1zVD--N4AaABAg,0,vN30emwcNS4,Thank you for the incredible public service you have done for the world since the beginning of the pandemic. We have learned so much from you. I do hope you will review Ivermectin soon.,2021-01-04T07:47:19Z,Dimitri Villard,https://yt3.ggpht.com/ytc/AKedOLRveBIUGAmsti-kioGvrvO93auv--KAlGSsJA=s48-c-k-c0x00ffffff-no-rj
UgzMJsGPia8tYYusl7N4AaABAg,0,vN30emwcNS4,Dr Campbell pointed out that you can put an oximeter on the finger ‘sideways ‘ if nail polish is blocking it,2021-01-04T07:33:44Z,Tuppy Brill,https://yt3.ggpht.com/ytc/AKedOLRpKinjYP9wzak9OPuquryPFz3Ykj_ebQdHKA=s48-c-k-c0x00ffffff-no-rj
